,CJDJH,GROSS,ROWNUM_,SEA_INLAND,SHIPNAME_CN,SHIP_OPERATOR,SHIP_OWNER,SPTYPE,_id
2010,2013N0000189,2994,2011,海船,百洋22,宁波百洋船务有限公司,宁波百洋船务有限公司,油船（闪点≤60℃）,5db846f95235e701bc7c1079
2011,2012T0000323,2075,2012,河船,凯瑞66,兴化市兴陵油运有限责任公司,兴化市兴陵油运有限责任公司,油船（闪点≤60℃）,5db846f95235e701bc7c107a
2012,2011W0000340,16504,2013,海船,中凯丰,江苏中凯海运有限公司,江苏中凯海运有限公司,散货船,5db846f95235e701bc7c107b
2013,1993L0000812,35874,2014,海船,粤电4,广东粤电航运有限公司,广东粤电航运有限公司,散货船,5db846f95235e701bc7c107c
2014,2008X0000130,498,2015,海船,盐田拖11,深圳盐田拖轮有限公司,深圳盐田拖轮有限公司,普通拖船,5db846f95235e701bc7c107d
2015,2006B0000322,2256,2016,海船,万华9,上海万荣船务有限公司,上海万荣船务有限公司,化学品液货船,5db846f95235e701bc7c107e
2016,3000B0002437,32890,2017,海船,H1097,泰州中达航运有限公司,泰州中达航运有限公司,散货船,5db846f95235e701bc7c107f
2017,2014T0000318,496,2018,海船,日港拖28,日照港股份有限公司,日照港股份有限公司,普通拖船,5db846f95235e701bc7c1080
2018,2009H0000125,8116,2019,海船,国裕17号,武汉江裕海运发展有限公司,武汉江裕海运发展有限公司,散货船,5db846f95235e701bc7c1081
2019,2011F0000394,33511,2020,海船,安锦山,中海散货运输(上海)有限公司,中海散货运输(上海)有限公司,散货船,5db846f95235e701bc7c1082
2020,2017T0000092,4604,2021,海船,凯沃,连云港五丰海运有限公司,连云港五丰海运有限公司,集装箱船,5db846f95235e701bc7c1083
2021,2010Y0000034,16449,2022,海船,宁龙,上海申龙海运有限公司,上海申龙海运有限公司,散货船,5db846f95235e701bc7c1084
2022,2006H0000190,583,2023,河船,汉道趸51,长江武汉航道局,长江武汉航道局,港用囤船,5db846f95235e701bc7c1085
2023,2010R0000280,33511,2024,海船,盛达海,海南海盛航运有限公司,海南海盛航运有限公司,散货船,5db846f95235e701bc7c1086
2024,2004V0000207,1469,2025,河船,新平江1024,南京长江油运有限公司,南京长江油运有限公司,油船（闪点≤60℃）,5db846f95235e701bc7c1087
2025,2005G4000271,1842,2026,河船,赣长江1号,抚州市长江实业集团有限公司,抚州市长江实业集团有限公司,化学品液货船,5db846f95235e701bc7c1088
2026,2018F0000664,2982,2027,河船,华通58,泰州市华通船务有限公司,泰州市华通船务有限公司,化学品液货船,5db846f95235e701bc7c1089
2027,1995Q0000719,22430,2028,河船,远通号,南通中远船务工程有限公司,南通中远船务工程有限公司,浮船坞,5db846f95235e701bc7c108a
2028,2012G0000565,8275,2029,海船,宝岛16号,-,-,客滚船,5db846f95235e701bc7c108b
2029,2014C0000395,1981,2030,海船,中国海监1010,中国海监大连市支队,中国海监大连市支队,巡逻船,5db846f95235e701bc7c108c
2030,2010B0000036,13380,2031,海船,联合11,宁波远洋运输有限公司,宁波远洋运输有限公司,散货船,5db846f95235e701bc7c108d
2031,2018E0000456,28554,2032,海船,中谷营口,上海中谷物流股份有限公司,上海中谷物流股份有限公司,集装箱船,5db846f95235e701bc7c108e
2032,2005M0000162,928,2033,河船,长轮26045,中石化长江燃料有限公司岳阳分公司,中石化长江燃料有限公司,油囤,5db846f95235e701bc7c108f
2033,2013V0000127,447,2034,海船,安东3,丹东港集团有限公司,丹东港集团有限公司,普通拖船,5db846f95235e701bc7c1090
2034,2009N0000130,3396,2035,河船,长江粮运12,四川长江粮运有限公司,四川长江粮运有限公司,散货船,5db846f95235e701bc7c1091
2035,2011T0000107,494,2036,海船,洋口拖1,南通洋口港拖轮有限公司,南通洋口港拖轮有限公司,普通拖船,5db846f95235e701bc7c1092
2036,2011K0001157,1738,2037,海船,建兴72,舟山市和兴船务有限公司,舟山市和兴船务有限公司等,化学品液货船,5db846f95235e701bc7c1093
2037,2015V0001157,1255,2038,海船,烟港洁海1,烟台港股份有限公司,烟台港股份有限公司,溢油(污油)回收船,5db846f95235e701bc7c1094
2038,2013J0000921,3648,2039,河船,远洋9607,重庆市泽胜船务（集团）有限公司,重庆市泽胜船务（集团）有限公司,化学品液货船,5db846f95235e701bc7c1095
2039,2013D0000065,7386,2040,海船,华杰油1,浙江省三门县宏达船务有限公司,雷保华等2人,油船（闪点≤60℃）,5db846f95235e701bc7c1096
2040,2004D0000260,5291,2041,河船,鸿发1,重庆鸿富船务有限公司,重庆鸿富船务有限公司,客滚船（Ⅱ型）,5db846f95235e701bc7c1097
2041,2013A0000637,3769,2042,河船,新长江26006,长航货运有限公司,交银金融租赁有限责任公司,散货船,5db846f95235e701bc7c1098
2042,2.02E+31,499,2043,海船,海港56,上海港复兴船务有限公司,上海港复兴船务有限公司,普通拖船,5db846f95235e701bc7c1099
2043,2.02E+31,499,2044,海船,海港56,上海港复兴船务有限公司,上海港复兴船务有限公司,普通拖船,5db846f95235e701bc7c109a
2044,2012S0001035,2987,2045,海船,祥鸿79,浙江祥鸿船务有限公司,浙江祥鸿船务有限公司等,油船（闪点≤60℃）,5db846f95235e701bc7c109b
2045,2007B0000101,345,2046,海船,仙洲 7,岱山县蓬莱客运轮船有限公司,岱山县蓬莱客运轮船有限公司,高速客船,5db846f95235e701bc7c109c
2046,2006N0000218,418,2047,河船,海巡12001,中华人民共和国重庆海事局,中华人民共和国长江海事局,巡逻船,5db846f95235e701bc7c109d
2047,2001J0000560,38580,2048,海船,兴航骏豪,泰州市兴航海运有限公司,泰州市兴航海运有限公司,散货船,5db846f95235e701bc7c109e
2048,2009W0000161,3389,2049,河船,长江粮运7,四川长江粮运有限公司,中航国际租赁有限公司,散货船,5db846f95235e701bc7c109f
2049,2013D0001008,3659,2050,河船,神州3518,重庆新金航国际物流股份有限公司,重庆新金航国际物流股份有限公司,化学品液货船,5db846f95235e701bc7c10a0
2050,2010R0000211,178,2051,海船,威景运7,威海刘公岛实业发展有限公司,威海刘公岛实业发展有限公司,滚装船,5db846f95235e701bc7c10a1
2051,2012E0000770,185,2052,海船,工银财富,厦门轮渡有限公司,厦门轮渡有限公司,客渡船,5db846f95235e701bc7c10a2
2052,2007D0000241,8110,2053,海船,集海之峰,上海海华轮船有限公司,上海海华轮船有限公司,集装箱船,5db846f95235e701bc7c10a3
2053,2015J0000249,999,2054,河船,湘金和198,湖南金和石油实业有限公司,湖南金和石油实业有限公司,油船（闪点≤60℃）,5db846f95235e701bc7c10a4
2054,2017F0000126,6653,2055,海船,博大36,象山兴宁航运有限公司,宁波博大船业有限公司,集装箱船,5db846f95235e701bc7c10a5
2055,2002P0000068,6785,2056,海船,京骅,神华中海航运有限公司,神华中海航运有限公司,散货船,5db846f95235e701bc7c10a6
2056,2012B0000997,2512,2057,河船,新长江25022,长航货运有限公司,工银金融租赁有限公司,散货船,5db846f95235e701bc7c10a7
2057,1993G0000509,2933,2058,海船,紫荆一号,广东徐闻港航控股有限公司,广东徐闻港航控股有限公司,客滚船,5db846f95235e701bc7c10a8
2058,2012W0001292,7959,2059,海船,海口六号,海口能运船务有限公司,海南金维嘉海运有限公司,客滚船,5db846f95235e701bc7c10a9
2059,3000A0000964,306,2060,海船,苏新船建2014-6,江苏华西村海洋工程服务有限公司,江苏华西村海洋工程服务有限公司,普通拖船,5db846f95235e701bc7c10aa
2060,2015X0000262,15817,2061,海船,昌盛集7,石狮昌盛船务有限公司,中远海运租赁有限公司,多用途船,5db846f95235e701bc7c10ab
2061,2015U0000190,998,2062,海船,凤凰如意,三亚浩洋大船服务有限公司,三亚浩洋大船服务有限公司,普通客船,5db846f95235e701bc7c10ac
2062,3000M0000216,306,2063,海船,苏新船建2014-5,江苏华西村海洋工程服务有限公司,江苏华西村海洋工程服务有限公司,普通拖船,5db846f95235e701bc7c10ad
2063,2015W0000353,1515,2064,河船,巴都,重庆市巴都游轮有限公司,重庆市巴都游轮有限公司,客船,5db846f95235e701bc7c10ae
2064,2019Q0000498,3850,2065,海船,嘉鸿26,泉州嘉鸿船务有限公司,泉州嘉鸿船务有限公司,散货船,5db846f95235e701bc7c10af
2065,2003S0000379,4200,2066,海船,海天号,中铁大桥局集团有限公司九江船舶分公司,中铁大桥局集团有限公司,工程船,5db846f95235e701bc7c10b0
2066,2010L0000620,2075,2067,河船,巨丰3,武汉金甲物流有限公司,武汉金甲物流有限公司,化学品液货船,5db846f95235e701bc7c10b1
2067,2017W0000463,6247,2068,海船,魏桥佳达29,天津惠桥船务有限公司,交银金融租赁有限责任公司,散货船,5db846f95235e701bc7c10b2
2068,1998F0000254,1974,2069,海船,信海2号,海南海峡航运股份有限公司,海南海峡航运股份有限公司,客滚船,5db846f95235e701bc7c10b3
2069,2007V0000257,2955,2070,河船,渝沪3502,重庆凯美特航运有限公司,重庆凯美特航运有限公司,化学品液货船,5db846f95235e701bc7c10b4
2070,2009H0000102,3389,2071,河船,长江粮运22,四川长江粮运有限公司,中航国际租赁有限公司,散货船,5db846f95235e701bc7c10b5
2071,2012N0000341,33437,2072,海船,金宁18,宁波合众海运有限公司,宁波合众海运有限公司,散货船,5db846f95235e701bc7c10b6
2072,2015C0000542,2229,2073,河船,吸盘3,-,-,挖泥船,5db846f95235e701bc7c10b7
2073,2002F0000428,30928,2074,海船,国电36,平潭国鸿船务有限公司,平潭国鸿船务有限公司,散货船,5db846f95235e701bc7c10b8
2074,2014U0000687,482,2075,海船,海港58,上海港复兴船务有限公司,上海港复兴船务有限公司,普通拖船,5db846f95235e701bc7c10b9
2075,2013H0000299,133,2076,海船,巡洋3,三亚巡洋游艇服务有限公司,三亚巡洋游艇服务有限公司,高速客船,5db846f95235e701bc7c10ba
2076,2014L0000196,2087,2077,河船,久鑫油3088,滁州久鑫运输有限公司,滁州久鑫运输有限公司,油船（闪点≤60℃）,5db846f95235e701bc7c10bb
2077,2016R0000380,4604,2078,海船,五洲103,连云港启顺海运有限公司,连云港启顺海运有限公司,集装箱船,5db846f95235e701bc7c10bc
2078,2012B0000928,29033,2079,海船,中鸿66,浙江中鸿海运有限公司,浙江中鸿海运有限公司等,散货船,5db846f95235e701bc7c10bd
2079,2019J0000423,31852,2080,海船,鼎鑫102,石狮鼎盛船务有限公司,石狮鼎盛船务有限公司,散货船,5db846f95235e701bc7c10be
2080,2010X0000953,5496,2081,河船,长航集运0322,重庆长航天一物流有限公司,交银金融租赁有限责任公司,集装箱船,5db846f95235e701bc7c10bf
2081,2011R0000703,498,2082,海船,金海重工7,金海智造股份有限公司,金海智造股份有限公司,交通船,5db846f95235e701bc7c10c0
2082,2014V0000205,282,2083,河船,中油供001,黄冈龙达船务有限公司,黄冈龙达船务有限公司,油船（闪点>60℃）,5db846f95235e701bc7c10c1
2083,2009G0000515,1549,2084,海船,满洋301,,浙江满洋船务工程有限公司、王信飞、王信辉,起重船,5db846f95235e701bc7c10c2
2084,2006H0000075,7144,2085,河船,凯娜,重庆市东江实业有限公司,重庆市东江实业有限公司,长江涉外旅游客船,5db846f95235e701bc7c10c3
2085,2014J0000378,937,2086,海船,中国考古01,国家文物局,国家文物局,科学调查船,5db846f95235e701bc7c10c4
2086,3000D0002462,3057,2087,河船,金甲5198,武汉金甲物流有限公司,武汉金甲物流有限公司,化学品液货船,5db846f95235e701bc7c10c5
2087,2013G0000298,1302,2088,河船,梧州石油238,广西梧州中昊实业有限责任公司,广西梧州中昊实业有限责任公司,油船（闪点≤60℃）,5db846f95235e701bc7c10c6
2088,2011E0001152,2084,2089,河船,长航金和305,南京长江金和油运有限公司,南京长江金和油运有限公司,化学品液货船,5db846f95235e701bc7c10c7
2089,2011P0000195,5937,2090,河船,民殷,民生轮船股份有限公司,民生轮船股份有限公司,集装箱船,5db846f95235e701bc7c10c8
2090,2018F0000687,10215,2091,河船,长航江瑞,长航武汉汽车物流有限公司,长航武汉汽车物流有限公司,滚装船,5db846f95235e701bc7c10c9
2091,1998J0000740,28147,2092,海船,金富源,平潭综合实验区金源海运有限公司,平潭综合实验区金源海运有限公司,集装箱船,5db846f95235e701bc7c10ca
2092,2008C0000341,2678,2093,河船,三通806,宜昌三通航运有限公司,宜昌三通航运有限公司,油船（闪点>60℃）,5db846f95235e701bc7c10cb
2093,2017N0001168,1894,2094,河船,苏金龙油518,金湖县金龙运输有限公司,金湖县金龙运输有限公司,油船（闪点≤60℃）,5db846f95235e701bc7c10cc
2094,3000K0002031,497,2095,海船,海港501,,,普通拖船,5db846f95235e701bc7c10cd
2095,2013X0000198,1310,2096,海船,中国海监9020,广东省渔政总队直属一支队,广东省渔政总队直属一支队,巡逻船,5db846f95235e701bc7c10ce
2096,2011H0001109,23161,2097,海船,新海星55,浙江新海星航务有限公司,浙江海洋租赁股份有限公司,散货船,5db846f95235e701bc7c10cf
2097,2018P0000511,2341,2098,河船,长江楚韵,宜昌巨能水路运输有限责任公司,宜昌巨能水路运输有限责任公司,油船（闪点≤60℃）,5db846f95235e701bc7c10d0
2098,2008T0000034,8580,2099,海船,昆仑油003,台州中油海运有限公司,台州中油海运有限公司,油船（闪点≤60℃）,5db846f95235e701bc7c10d1
2099,2018L0000853,494,2100,海船,北船拖6,青岛北海船舶重工有限责任公司,青岛北海船舶重工有限责任公司,普通拖船,5db846f95235e701bc7c10d2
2100,2012T0000737,442,2101,河船,盛禾6,泰州盛禾船务有限公司,泰州盛禾船务有限公司,普通拖船,5db846fb5235e701bc7c10d3
2101,2013X0000313,1302,2102,河船,梧州石油228,广西梧州中昊实业有限责任公司,广西梧州中昊实业有限责任公司,油船（闪点≤60℃）,5db846fb5235e701bc7c10d4
2102,2013F0000389,12147,2103,海船,新奥泰161,乐清市利达海运有限公司,上海国金融资租赁有限公司,油船（闪点≤60℃）,5db846fb5235e701bc7c10d5
2103,2015B0001277,566,2104,海船,连港9,大连港股份有限公司,大连港股份有限公司,普通拖船,5db846fb5235e701bc7c10d6
2104,2010W0000492,16554,2105,海船,同心一舸,台州五星海运有限公司,浙江协和首信钢业有限公司,散货船,5db846fb5235e701bc7c10d7
2105,2011K0000030,334,2106,海船,三航拖1012,中交三航局第三工程有限公司,中交三航局第三工程有限公司,普通拖船,5db846fb5235e701bc7c10d8
2106,2012C0001205,499,2107,海船,京唐港拖17,唐山港集团股份有限公司,唐山港集团股份有限公司,普通拖船,5db846fb5235e701bc7c10d9
2107,2014D0000212,3390,2108,河船,三通5001,宜昌三通航运有限公司,宜昌三通航运有限公司,油船（闪点>60℃）,5db846fb5235e701bc7c10da
2108,2012N0000686,2512,2109,河船,新长江25036,长航货运有限公司,长航货运有限公司,散货船,5db846fb5235e701bc7c10db
2109,2015M0000390,495,2110,海船,鼓浪之星,厦门轮总海上客运旅游有限公司,厦门轮总海上客运旅游有限公司,普通客船,5db846fb5235e701bc7c10dc
2110,2010V0000698,7143,2111,海船,银紫荆,广东徐闻港航控股有限公司,广东徐闻港航控股有限公司,客滚船,5db846fb5235e701bc7c10dd
2111,2010V0000698,7143,2112,海船,银紫荆,广东徐闻港航控股有限公司,广东徐闻港航控股有限公司,客滚船,5db846fb5235e701bc7c10de
2112,2015S0001384,4276,2113,河船,永盛998,云阳县永盛实业有限公司,云阳县永盛实业有限公司,散货船,5db846fb5235e701bc7c10df
2113,2014J0000585,491,2114,海船,湛港拖17,湛江港（集团）股份有限公司,湛江港（集团）股份有限公司,普通拖船,5db846fb5235e701bc7c10e0
2114,2013A0000844,30421,2115,海船,浙海105,浙江省海运集团有限公司,工银金融租赁有限公司,散货船,5db846fb5235e701bc7c10e1
2115,2015A0000172,3769,2116,河船,新长江06072,长航货运有限公司,交银金融租赁有限责任公司,散货船,5db846fb5235e701bc7c10e2
2116,2013L5100023,15,2117,海船,中国海关3561,黄埔海关,黄埔海关,巡逻船,5db846fb5235e701bc7c10e3
2117,2011M0000377,2489,2118,海船,云桩1号,连云港港务工程公司,连云港港务工程公司,打桩船,5db846fb5235e701bc7c10e4
2118,3000M0000331,5614,2119,海船,帆顺8800DWT油船/FS/C12-25,上海安润海运有限公司,上海安润海运有限公司,油船（闪点≤60℃）,5db846fb5235e701bc7c10e5
2119,1995Q0000742,24964,2120,海船,天龙星,上海时代航运有限公司,上海时代航运有限公司,散货船,5db846fb5235e701bc7c10e6
2120,2013N0000557,38919,2121,海船,鹏利,深圳远洋运输股份有限公司,深圳远洋运输股份有限公司,散货船,5db846fb5235e701bc7c10e7
2121,2011M0000285,2476,2122,海船,宏油17,舟山市海宏石油运输有限公司,舟山市海宏石油运输有限公司,油船（闪点≤60℃）,5db846fb5235e701bc7c10e8
2122,2015K0000273,597,2123,河船,统运555,张家港保税区兴运船务有限公司,张家港保税区兴运船务有限公司,化学品液货船,5db846fb5235e701bc7c10e9
2123,2012K0000545,8236,2124,海船,新海福,上海海一航运有限公司,上海海一航运有限公司,散货船,5db846fb5235e701bc7c10ea
2124,2010T0000512,33511,2125,海船,新世纪198,神华中海航运有限公司,神华中海航运有限公司,散货船,5db846fb5235e701bc7c10eb
2125,2011M0001159,33511,2126,海船,安泰山,中海散货运输（上海）有限公司,中海散货运输（上海）有限公司,散货船,5db846fb5235e701bc7c10ec
2126,2013X0000221,30127,2127,海船,兴航旭,江苏兴航船务有限公司,江苏金融租赁股份有限公司,散货船,5db846fb5235e701bc7c10ed
2127,2013N0000281,19296,2128,海船,仁建京唐,泉州安通物流有限公司,中航国际租赁有限公司,多用途船,5db846fb5235e701bc7c10ee
2128,2006U0000132,6458,2129,河船,和济601,宜昌和济运输股份有限公司,宜昌和济运输股份有限公司,客滚船（Ⅱ型）,5db846fb5235e701bc7c10ef
2129,2012D0000769,17271,2130,海船,浙海158,浙江省海运集团有限公司,交银金融租赁有限责任公司,散货船,5db846fb5235e701bc7c10f0
2130,2011K0001180,2123,2131,河船,金甲3188,武汉金甲物流有限公司,武汉金甲物流有限公司,化学品液货船,5db846fb5235e701bc7c10f1
2131,3000D0001703,388,2132,海船,新跨越,武昌船舶重工集团有限公司,武昌船舶重工集团有限公司,普通拖船,5db846fb5235e701bc7c10f2
2132,2012S0000690,2219,2133,河船,鄂石3068,湖北汉通石油运输贸易有限责任公司,湖北汉通石油运输贸易有限责任公司,化学品液货船,5db846fb5235e701bc7c10f3
2133,3000L0000100,650,2134,河船,绿动1031,,,一般干货船,5db846fb5235e701bc7c10f4
2134,2013U0000356,1962,2135,海船,润丰油17,大连东源船务有限公司,大连东源船务有限公司,油船（闪点≤60℃）,5db846fb5235e701bc7c10f5
2135,2016R0000012,3705,2136,海船,舟桥3,嵊泗县同舟客运轮船有限公司,嵊泗县同舟客运轮船有限公司,客滚船,5db846fb5235e701bc7c10f6
2136,1995L0000508,2933,2137,海船,岱山12,岱山县蓬莱客运轮船有限公司,岱山县蓬莱客运轮船有限公司,客滚船,5db846fb5235e701bc7c10f7
2137,2011S0001187,2952,2138,海船,新富源16,舟山富源船务有限公司,舟山富源船务有限公司等,油船（闪点≤60℃）,5db846fb5235e701bc7c10f8
2138,2005U0000031,994,2139,河船,新平江1031,南京长江油运有限公司,南京长江油运有限公司,油船（闪点≤60℃）,5db846fb5235e701bc7c10f9
2139,2007R0000253,2871,2140,海船,闽油101,福建省实华船务有限公司,福建省实华船务有限公司,油船（闪点≤60℃）,5db846fb5235e701bc7c10fa
2140,2012B0000353,2777,2141,河船,乾峰1002,重庆市乾峰船务有限公司,重庆市乾峰船务有限公司,化学品液货船,5db846fb5235e701bc7c10fb
2141,3000P0003208,17200,2142,河船,华夏神女3,重庆大美长江三峡游轮股份有限公司,重庆大美长江三峡游轮股份有限公司,客船,5db846fb5235e701bc7c10fc
2142,2017T0001035,492,2143,海船,翎航拖2,东营翎航港务有限公司,东营翎航港务有限公司,普通拖船,5db846fb5235e701bc7c10fd
2143,1991T0000824,7854,2144,海船,安吉6,上海安盛汽车船务有限公司,上海安盛汽车船务有限公司,滚装船,5db846fb5235e701bc7c10fe
2144,2012L0001052,2997,2145,海船,国扬118,浙江国扬海运有限公司,浙江国扬海运有限公司等,油船（闪点≤60℃）,5db846fb5235e701bc7c10ff
2145,2014B0000141,10940,2146,海船,黎母岭,海南海峡航运股份有限公司,海南海峡航运股份有限公司,客滚船,5db846fb5235e701bc7c1100
2146,2017L0000798,2686,2147,河船,和海99,扬州鑫联运输有限公司,扬州鑫联运输有限公司,化学品液货船,5db846fb5235e701bc7c1101
2147,2016B0000159,998,2148,河船,华通飞浩,泰州市华通船务有限公司,泰州市华通船务有限公司,化学品液货船,5db846fb5235e701bc7c1102
2148,2012K0000913,2512,2149,河船,新长江25056,长航货运有限公司,长航货运有限公司,散货船,5db846fb5235e701bc7c1103
2149,2008W0000129,533,2150,海船,三航拖2010,中交三航局第三工程有限公司,中交三航局第三工程有限公司,普通拖船,5db846fb5235e701bc7c1104
2150,2015G0000569,283,2151,河船,武船疏浚2号,武昌船舶重工集团有限公司,武昌船舶重工集团有限公司,耙吸式挖泥船,5db846fb5235e701bc7c1105
2151,2003N0000329,4504,2152,海船,双泰9,广东双泰运输集团有限责任公司,广东双泰运输集团有限责任公司,客滚船,5db846fb5235e701bc7c1106
2152,2018J0000713,2782,2153,河船,和海9988,扬州龙川运输有限公司,扬州龙川运输有限公司,化学品液货船,5db846fb5235e701bc7c1107
2153,2012N0001031,3571,2154,河船,重轮化3510,重庆凯美特航运有限公司,重庆凯美特航运有限公司,化学品液货船,5db846fb5235e701bc7c1108
2154,2014R0000362,1239,2155,海船,玉环6,玉环滚装轮渡有限公司,玉环滚装轮渡有限公司,客滚船,5db846fb5235e701bc7c1109
2155,2018Q0000765,23811,2156,河船,归来三峡,重庆市归来印象旅游文化发展有限公司,重庆奉节生态旅游开发有限公司,餐饮趸船,5db846fb5235e701bc7c110a
2156,2011T0001073,3658,2157,河船,宁化501,南京长江油运物流有限公司,江西东港航运有限公司,化学品液货船,5db846fb5235e701bc7c110b
2157,2008Q0000238,8110,2158,海船,集海之鸿,上海海华轮船有限公司,上海海华轮船有限公司,集装箱船,5db846fb5235e701bc7c110c
2158,2011N0000746,2999,2159,海船,凯丰17,舟山凯丰海运有限公司,舟山凯丰海运有限公司,油船（闪点≤60℃）,5db846fb5235e701bc7c110d
2159,2009K0000104,33511,2160,海船,中海昌运2,中远海运散货运输有限公司,中远海运散货运输有限公司,散货船,5db846fb5235e701bc7c110e
2160,2008M0000212,3453,2161,河船,长江粮运56,四川长江粮运有限公司,中航国际租赁有限公司,散货船,5db846fb5235e701bc7c110f
2161,2007F4000219,2237,2162,河船,神州2008,重庆新金航国际物流股份有限公司,重庆新金航国际物流股份有限公司,化学品液货船,5db846fb5235e701bc7c1110
2162,2013M0000349,3769,2163,河船,新长江06035,长航货运有限公司,长航货运有限公司,散货船,5db846fb5235e701bc7c1111
2163,2012P0000687,2512,2164,河船,新长江25031,长航货运有限公司,长航货运有限公司,散货船,5db846fb5235e701bc7c1112
2164,2013P0000167,2700,2165,河船,龙润,南京龙翔液体化工储运码头有限公司,南京龙翔液体化工储运码头有限公司,化学品液货囤,5db846fb5235e701bc7c1113
2165,1994Q0000503,2622,2166,海船,北部湾1号,北海新绎游船有限公司,北海新绎游船有限公司,客滚船,5db846fb5235e701bc7c1114
2166,2017D0001412,1590,2167,河船,安庆石化3号趸,中国石油化工股份有限公司安庆分公司,中国石油化工股份有限公司安庆分公司,油囤,5db846fb5235e701bc7c1115
2167,2007U3100081,1817,2168,海船,佳酉7号,深圳市佳酉船务有限公司,深圳市佳酉船务有限公司,油船（闪点≤60℃）,5db846fb5235e701bc7c1116
2168,2010J0000917,375,2169,河船,江城8号,武汉市轮渡公司,武汉市轮渡公司,客渡船,5db846fb5235e701bc7c1117
2169,2011U0000890,2999,2170,海船,康发86,舟山市普陀安顺海运有限责任公司,舟山市普陀安顺海运有限责任公司,油船（闪点≤60℃）,5db846fb5235e701bc7c1118
2170,2014F0000766,3547,2171,河船,宏声87,重庆三益物流股份有限公司,重庆三益物流股份有限公司,化学品液货船,5db846fb5235e701bc7c1119
2171,2012N0000778,3769,2172,河船,新长江06004,长航货运有限公司,交银金融租赁有限责任公司,散货船,5db846fb5235e701bc7c111a
2172,2015M0000551,3038,2173,河船,中南油28,鄂州市三江油运有限责任公司,鄂州市三江油运有限责任公司,化学品液货船,5db846fb5235e701bc7c111b
2173,2015L0000642,2935,2174,海船,新润16,天津麦道科技有限公司,天津麦道科技有限公司,甲板货船,5db846fb5235e701bc7c111c
2174,2017N0001007,1994,2175,河船,乐航918,武汉海通船舶运输有限公司,武汉海通船舶运输有限公司,化学品液货船,5db846fb5235e701bc7c111d
2175,2007F0000358,4175,2176,河船,港盛1016,重庆港盛欣陵船务有限公司,重庆港盛船务有限公司,集装箱船,5db846fb5235e701bc7c111e
2176,2012P0001377,922,2177,河船,长燃60,武汉长燃运输有限公司,中石化长江燃料有限公司,油船（闪点>60℃）,5db846fb5235e701bc7c111f
2177,2010L0000942,2226,2178,河船,赣长江18号,抚州市长江实业集团有限公司,抚州市长江实业集团有限公司,化学品液货船,5db846fb5235e701bc7c1120
