,CJDJH,GROSS,ROWNUM_,SEA_INLAND,SHIPNAME_CN,SHIP_OPERATOR,SHIP_OWNER,SPTYPE,_id
2844,2.01E+281,2377,2845,河船,重轮化2005,重庆凯美特航运有限公司,重庆凯美特航运有限公司,化学品液货船,5db847045235e701bc7c13bb
2845,2009R0000225,2461,2846,海船,鸿霖浚18,浙江鸿霖船舶工程有限公司,民生金融租赁股份有限公司,绞吸式挖泥船,5db847045235e701bc7c13bc
2846,3000F0001107,2491,2847,河船,3000吨级多用途货船-4,广西邕江资产管理有限公司,广西邕江资产管理有限公司,集装箱船,5db847045235e701bc7c13bd
2847,1991Q0000775,31123,2848,河船,南通,南通中远船务工程有限公司,"Ocean Tramping Co.,Ltd.(Hong Kong)",浮船坞,5db847045235e701bc7c13be
2848,2009H0000401,3389,2849,河船,长江粮运2,四川长江粮运有限公司,中航国际租赁有限公司,散货船,5db847045235e701bc7c13bf
2849,2018K0000760,2669,2850,河船,秋沣6,扬州裕华航运有限公司,扬州裕华航运有限公司,化学品液货船,5db847045235e701bc7c13c0
2850,2014U0001055,491,2851,海船,岚港拖67,日照港股份有限公司,日照港股份有限公司,普通拖船,5db847045235e701bc7c13c1
2851,3000K0002353,47,2852,海船,ZY5525,,,游艇（12人及以下）,5db847045235e701bc7c13c2
2852,2019K0000263,450,2853,海船,新嘉舟5,上海和启汇企业发展有限公司,上海和启汇企业发展有限公司,普通拖船,5db847045235e701bc7c13c3
2853,2012X0000304,457,2854,海船,和达拖5,舟山和丰船务有限公司,舟山和丰船务有限公司,普通拖船,5db847045235e701bc7c13c4
2854,3000G0002419,10091,2855,海船,W1852,,珠海港航运有限公司,散货船,5db847045235e701bc7c13c5
2855,2010X0000700,696,2856,海船,新皇冠,广西呈慈航水路营运股份有限公司,广西呈慈航水路营运股份有限公司,普通旅游客船,5db847045235e701bc7c13c6
2856,2012P0000756,998,2857,河船,湘金和103,湖南金和石油实业有限公司,湖南金和石油实业有限公司,油船（闪点≤60℃）,5db847045235e701bc7c13c7
2857,2015L0001217,465,2858,河船,南油国援1,南京长江油运公司,南京长江油运公司,拖（推）船,5db847045235e701bc7c13c8
2858,2014K0000149,349,2859,海船,东驳12,-,-,工程船,5db847045235e701bc7c13c9
2859,2007J0000016,2823,2860,海船,琼沙3号,三沙市船务管理局,三沙市船务管理局,客货船,5db847045235e701bc7c13ca
2860,2006W0000364,3719,2861,河船,中远05,上海泛亚航运有限公司,上海泛亚航运有限公司,集装箱船,5db847045235e701bc7c13cb
2861,2012M0000961,3358,2862,河船,锦龙628,黄冈龙达船务有限公司,黄冈龙达船务有限公司,化学品液货船,5db847045235e701bc7c13cc
2862,2012V0000555,489,2863,海船,舟环卫8,舟山市公用事业管理中心,舟山市公用事业管理中心,车客渡船,5db847045235e701bc7c13cd
2863,2012A0000789,2599,2864,河船,锦龙126,黄冈龙达船务有限公司,黄冈龙达船务有限公司,化学品液货船,5db847045235e701bc7c13ce
2864,2014N0000796,2042,2865,河船,华通油12,泰州市华通船务有限公司,泰州市华通船务有限公司,油船（闪点≤60℃）,5db847045235e701bc7c13cf
2865,2005A0000381,478,2866,河船,华武趸3号,华新水泥股份有限公司,华新水泥股份有限公司,港用囤船,5db847045235e701bc7c13d0
2866,3000H0002259,10091,2867,海船,W1851,珠海港航运有限公司,珠海港航运有限公司,散货船,5db847045235e701bc7c13d1
2867,2019R0000499,21191,2868,海船,华达609,厦门信华达船运有限责任公司,厦门信华达船运有限责任公司,集装箱船,5db847045235e701bc7c13d2
2868,2003J0000371,4103,2869,河船,吉祥718,宜昌吉祥滚装船运输有限公司,宜昌吉祥滚装船运输有限公司,客滚船（Ⅱ型）,5db847045235e701bc7c13d3
2869,2.01E+230,3571,2870,河船,重轮化3511,重庆凯美特航运有限公司,重庆凯美特航运有限公司,化学品液货船,5db847045235e701bc7c13d4
2870,2010C0000382,37,2871,河船,航迅201,长江泸州航道局,长江泸州航道局,巡逻船,5db847045235e701bc7c13d5
2871,2014U0000089,592,2872,海船,中海拖5,中海工业（上海长兴）有限公司,中海工业有限公司,普通拖船,5db847045235e701bc7c13d6
2872,2010W0000538,22,2873,海船,指挥艇,常州玻璃钢造船厂,常州玻璃钢造船厂,货船,5db847045235e701bc7c13d7
2873,2013Y0000038,3549,2874,河船,远洋9008,重庆市泽胜船务（集团）有限公司,重庆市泽胜船务（集团）有限公司,化学品液货船,5db847045235e701bc7c13d8
2874,2012S0000805,623,2875,海船,海港116,上海深水港船务有限公司,上海深水港船务有限公司,普通拖船,5db847045235e701bc7c13d9
2875,2016V0000775,2415,2876,海船,远东启航,惠州华亿荣盛船务有限公司,上海国金租赁有限公司,化学品液货船,5db847045235e701bc7c13da
2876,2017C0000307,1852,2877,河船,长轮39014,中石化长江燃料有限公司重庆分公司,中石化长江燃料有限公司,油囤,5db847045235e701bc7c13db
2877,3000C0001495,15932,2878,海船,BC258-1-17,,,散货船,5db847045235e701bc7c13dc
2878,3000X0002526,90,2879,海船,JS-CAT2000WB-3,,,小艇,5db847045235e701bc7c13dd
2879,3000N0000171,9927,2880,河船,18000DWT-3,,瑞昌市金海轮船有限公司,散货船,5db847045235e701bc7c13de
2880,2008B0000064,34,2881,河船,航迅 7,长江南京航道局,长江南京航道局,测量船,5db847045235e701bc7c13df
2881,2006N0000057,6487,2882,海船,长盈海,长航货运有限公司,中国长江航运集团有限公司,散货船,5db847045235e701bc7c13e0
2882,2011V0000707,5619,2883,海船,九泰油3,威海远达航运有限公司,威海远达航运有限公司,油船（闪点≤60℃）,5db847045235e701bc7c13e1
2883,2018Q0000742,10,2884,海船,鹦鹉螺10号,海南蜈支洲旅游开发股份有限公司,海南蜈支洲旅游开发股份有限公司,小艇,5db847045235e701bc7c13e2
2884,2019S0000385,14165,2885,海船,弘泰222,厦门闽捷船务有限公司,厦门闽捷船务有限公司,集装箱船,5db847045235e701bc7c13e3
2885,2017R0000090,4604,2886,海船,克东,连云港五丰海运有限公司,连云港五丰海运有限公司,集装箱船,5db847045235e701bc7c13e4
2886,2012R0000597,16504,2887,海船,勤丰28,浙江勤丰海运有限公司,梁晓友等,散货船,5db847045235e701bc7c13e5
2887,2006R0000382,5151,2888,海船,江夏平,上海海一航运有限公司,上海海一航运有限公司,散货船,5db847045235e701bc7c13e6
2888,2016G0000187,992,2889,河船,金江海66,铜陵金江海运贸有限责任公司,铜陵金江海运贸有限责任公司,化学品液货船,5db847045235e701bc7c13e7
2889,2013V0000196,28733,2890,海船,华润电力5,天津中海华润航运有限公司,农银金融租赁有限公司,散货船,5db847045235e701bc7c13e8
2890,2012A0000927,2993,2891,海船,港祺18,上海博丰昌顺海运有限公司,上海博丰昌顺海运有限公司,油船（闪点≤60℃）,5db847045235e701bc7c13e9
2891,2018L0000715,299,2892,海船,海岛玩家1号,海南蜈支洲旅游开发股份有限公司,海南蜈支洲旅游开发股份有限公司,港用囤船,5db847045235e701bc7c13ea
2892,2010R0000441,16252,2893,海船,长领海,武汉长航新凤凰物流有限责任公司,武汉长航新凤凰物流有限责任公司,散货船,5db847045235e701bc7c13eb
2893,2017R0000918,12,2894,海船,蜈支洲飞鱼2号,海南蜈支洲旅游开发股份有限公司,海南蜈支洲旅游开发股份有限公司,小艇,5db847045235e701bc7c13ec
2894,2012H0001187,26682,2895,海船,天润之58,舟山天润船务有限公司,舟山天润船务有限公司,散货船,5db847045235e701bc7c13ed
2895,2013Q0000858,29152,2896,海船,神华525,神华中海航运有限公司,神华中海航运有限公司,散货船,5db847045235e701bc7c13ee
2896,2008U0000012,7994,2897,海船,江夏发,上海海一航运有限公司,上海海一航运有限公司,散货船,5db847045235e701bc7c13ef
2897,2004Y0000256,2300,2898,海船,佳酉16号,深圳市佳酉船务有限公司,深圳市佳酉船务有限公司,油船（闪点≤60℃）,5db847045235e701bc7c13f0
2898,2004X0000370,2153,2899,河船,瑞江1,武汉奥华船务运输有限公司,重庆长江轮船公司,散货船,5db847045235e701bc7c13f1
2899,2010B0000427,251,2900,海船,中国边检3567,中华人民共和国东渡出入境边防检查站,中华人民共和国东渡出入境边防检查站,巡逻船,5db847045235e701bc7c13f2
2900,2001C0000577,26555,2901,海船,盛帆7,平潭盛帆海运有限公司,平潭盛帆海运有限公司,散货船,5db847055235e701bc7c13f3
2901,1995N0000855,25457,2902,海船,国电10,天津国电海运有限公司,天津国电海运有限公司,散货船,5db847055235e701bc7c13f4
2902,1991U0000503,1998,2903,海船,海装08,徐闻县海运有限公司,徐闻县海运有限公司,Ⅲ级客滚船,5db847055235e701bc7c13f5
2903,2011F0000877,2214,2904,河船,神州2016,重庆新金航国际物流股份有限公司,重庆新金航国际物流股份有限公司,化学品液货船,5db847055235e701bc7c13f6
2904,2016S0000680,1784,2905,河船,长轮39010,中石化长江燃料有限公司,中石化长江燃料有限公司,油囤,5db847055235e701bc7c13f7
2905,2012B0000836,373,2906,海船,华能海拖1,华能广东海门港务有限责任公司,华能广东海门港务有限责任公司,普通拖船,5db847055235e701bc7c13f8
2906,2007R0000368,355,2907,海船,海港107,上海深水港船务有限公司,上海深水港船务有限公司,普通拖船,5db847055235e701bc7c13f9
2907,2019L0000540,4,2908,河船,中国海关5109,中华人民共和国江门海关,中华人民共和国江门海关,快艇,5db847055235e701bc7c13fa
2908,2011L0001158,1738,2909,海船,建兴71,舟山市和兴船务有限公司,舟山市和兴船务有限公司等,化学品液货船,5db847055235e701bc7c13fb
2909,2012G4100660,2,2910,河船,中国海关3521,中华人民共和国黄埔海关,中华人民共和国黄埔海关,巡逻船,5db847055235e701bc7c13fc
2910,2013F0000067,31640,2911,海船,华浩57,中能华航船务有限公司,中能华航船务有限公司,散货船,5db847055235e701bc7c13fd
2911,2010R0000993,472,2912,海船,丰港3,盐城吉宝斯密特拖轮服务有限公司,盐城吉宝斯密特拖轮服务有限公司,普通拖船,5db847055235e701bc7c13fe
2912,2011X0000663,33511,2913,海船,安华山,中海散货运输有限公司,中海散货运输有限公司,散货船,5db847055235e701bc7c13ff
2913,2012X0001017,3769,2914,河船,新长江06006,长航货运有限公司,交银金融租赁有限责任公司,散货船,5db847055235e701bc7c1400
2914,2010P0000554,2221,2915,河船,宏声3103,重庆三益物流股份有限公司,昆仑金融租赁有限责任公司,化学品液货船,5db847055235e701bc7c1401
2915,2001T0000293,2547,2916,河船,3-浮400,重庆港九股份有限公司,重庆港九股份有限公司,起重囤船,5db847055235e701bc7c1402
2916,2014A0000393,5860,2917,海船,蓝鲸一,,大连蓝海湾船务有限公司,半潜驳,5db847055235e701bc7c1403
2917,3000Y0002182,515,2918,海船,2942kW全回转拖轮（FXSL2018130）,,,普通拖船,5db847055235e701bc7c1404
2918,1985E0000504,801,2919,海船,粤民426,徐闻县海运有限公司,广东省湛江航运集团有限公司,Ⅲ级客滚船,5db847055235e701bc7c1405
2919,2017J0001302,2711,2920,河船,华通555,泰州市华通船务有限公司,泰州市华通船务有限公司,油船（闪点≤60℃）,5db847055235e701bc7c1406
2920,2010H0000732,2237,2921,河船,锦龙100,黄冈龙达船务有限公司,黄冈龙达船务有限公司,油船（闪点≤60℃）,5db847055235e701bc7c1407
2921,2017K0001096,4260,2922,海船,京海盛,广州京海航运有限公司,广州京海航运有限公司,散货船,5db847055235e701bc7c1408
2922,2011J0000604,242,2923,海船,金东海港作1,广东金东海集团有限公司,广东金东海集团有限公司,抛锚船,5db847055235e701bc7c1409
2923,3000C0000943,920,2924,河船,深能629,贵州深能航运股份有限公司,贵州深能航运股份有限公司,集装箱船,5db847055235e701bc7c140a
2924,3000L0000767,378,2925,海船,2942kW近海全回转拖轮,汕头市四海航务有限公司,汕头市四海航务有限公司,拖（推）船,5db847055235e701bc7c140b
2925,2008V0000013,5761,2926,河船,民权,民生轮船股份有限公司,民生轮船股份有限公司,集装箱船,5db847055235e701bc7c140c
2926,2014Y0000185,459,2927,海船,厦港拖20,厦门港务船务有限公司,厦门港务船务有限公司,普通拖船,5db847055235e701bc7c140d
2927,2010R0001039,32862,2928,海船,鸿阳山,华洋海事中心,洋浦鸿阳海运有限公司,散货船,5db847055235e701bc7c140e
2928,2003B0000548,30369,2929,海船,长安258,温岭市长安海运有限公司,温岭市长安海运有限公司,散货船,5db847055235e701bc7c140f
2929,2017U0000185,6247,2930,海船,魏桥佳达16,天津惠桥船务有限公司,天津惠桥船务有限公司,散货船,5db847055235e701bc7c1410
2930,2013T0000079,27146,2931,海船,北仑11,宁波北仑船务有限公司,宁波北仑船务有限公司,散货船,5db847055235e701bc7c1411
2931,2018Q0000397,88,2932,海船,东海救321,交通运输部东海救助局,交通运输部东海救助局,辅助船,5db847055235e701bc7c1412
2932,2011Q0000840,2325,2933,河船,鄂石3966,湖北汉通石油运输贸易有限责任公司,湖北汉通石油运输贸易有限责任公司,油船（闪点≤60℃）,5db847055235e701bc7c1413
2933,2012Q0000780,2219,2934,河船,鄂石3098,湖北汉通石油运输贸易有限责任公司,湖北汉通石油运输贸易有限责任公司,化学品液货船,5db847055235e701bc7c1414
2934,2016H0000372,992,2935,河船,金江海298,铜陵金江海运贸有限责任公司,铜陵金江海运贸有限责任公司,化学品液货船,5db847055235e701bc7c1415
2935,2012Q0000274,2512,2936,河船,新长江25052,长航货运有限公司,长航货运有限公司,散货船,5db847055235e701bc7c1416
2936,2011K0000605,242,2937,海船,金东海港作2,广东金东海集团有限公司,广东金东海集团有限公司,抛锚船,5db847055235e701bc7c1417
2937,2014Q0000246,29153,2938,海船,神华516,神华中海航运有限公司,神华中海航运有限公司,散货船,5db847055235e701bc7c1418
2938,1995T0000860,25067,2939,海船,国电28,天津国电海运有限公司,天津国电海运有限公司,散货船,5db847055235e701bc7c1419
2939,2011J0000765,2368,2940,河船,援圭亚那渡船1,同方江新造船有限公司,同方江新造船有限公司,客滚船（Ⅰ型）,5db847055235e701bc7c141a
2940,2013U0001069,19495,2941,海船,江泉6,华盛江泉海运有限公司,华盛江泉海运有限公司,散货船,5db847055235e701bc7c141b
2941,2012H0000934,25406,2942,海船,华盛116,温州华顺船务有限公司,温州华顺船务有限公司,散货船,5db847055235e701bc7c141c
2942,2006T0000177,1797,2943,河船,宁港33,南京港（集团）有限公司,南京港（集团）有限公司,散货船,5db847055235e701bc7c141d
2943,2012N0000111,558,2944,海船,德涞,烟台打捞局,烟台打捞局,普通拖船,5db847055235e701bc7c141e
2944,2016E0000898,167,2945,海船,中国海警44029,,,快艇,5db847055235e701bc7c141f
2945,2004C0000121,990,2946,河船,新平江1019,南京长江油运公司,南京长江油运公司,油船（闪点≤60℃）,5db847055235e701bc7c1420
2946,2010Y0000103,166,2947,海船,旭阳9号,三亚振源水上运输有限公司,三亚振源水上运输有限公司,高速客船,5db847055235e701bc7c1421
2947,2016A0000089,2992,2948,海船,建兴15,舟山市和兴船务有限公司,舟山市和兴船务有限公司,化学品液货船,5db847055235e701bc7c1422
2948,2005V0000423,921,2949,海船,交工63,中交第一航务工程局有限公司,中交第一航务工程局有限公司,普通拖船,5db847055235e701bc7c1423
2949,2018B0000108,14172,2950,海船,弘泰223,厦门闽捷船务有限公司,厦门闽捷船务有限公司,集装箱船,5db847055235e701bc7c1424
2950,2007U3100725,4676,2951,海船,大庆761,舟山浙华石油运输有限公司,舟山浙华石油运输有限公司,油船（闪点≤60℃）,5db847055235e701bc7c1425
2951,2013B0000385,19617,2952,海船,神鱼68,宁波神鱼海运有限公司,宁波神鱼海运有限公司等,散货船,5db847055235e701bc7c1426
2952,2016W0000753,9283,2953,河船,华嘉1号,重庆华阳嘉川船务有限公司,重庆华阳嘉川船务有限公司,滚装船,5db847055235e701bc7c1427
2953,2012M0000041,2952,2954,海船,百洋58,宁波百洋船务有限公司,宁波百洋船务有限公司、陈世伟,油船（闪点≤60℃）,5db847055235e701bc7c1428
2954,3000N0000332,6394,2955,河船,400客涉外旅游船,宜昌三峡国际游轮有限公司,宜昌三峡国际游轮有限公司,长江涉外旅游客船,5db847055235e701bc7c1429
2955,2016M0000054,995,2956,河船,皖庐东7,合肥庐东航运有限公司,合肥庐东航运有限公司,化学品液货船,5db847055235e701bc7c142a
2956,1994B3106732,377,2957,海船,万邦永跃拖1,舟山万邦永跃船舶修造有限公司,舟山万邦永跃船舶修造有限公司,普通拖船,5db847055235e701bc7c142b
2957,2013C0000754,3699,2958,海船,舟海油76,舟山海光海运有限公司,舟山海光海运有限公司,油船（闪点≤60℃）,5db847055235e701bc7c142c
2958,2013L0000900,223,2959,海船,蓝骑士1,深圳市鹏星船务有限公司,深圳市鹏星船务有限公司,高速客船,5db847055235e701bc7c142d
2959,2018K0000484,3456,2960,海船,连船海吊,大连船舶重工集团有限公司,大连船舶重工集团有限公司,起重船,5db847055235e701bc7c142e
2960,2008W0000152,13675,2961,海船,中汇22,安徽中汇海运有限公司,安徽中汇海运有限公司,散货船,5db847055235e701bc7c142f
2961,2004B0000350,383,2962,海船,仙洲6,岱山县蓬莱客运轮船有限公司,岱山县蓬莱客运轮船有限公司,高速客船,5db847055235e701bc7c1430
2962,2014W0000206,592,2963,海船,扬州重工拖8,扬州中远海运重工有限公司,扬州中远海运重工有限公司,普通拖船,5db847055235e701bc7c1431
2963,2007J0000039,155,2964,海船,春兰,厦门轮总海上客运旅游有限公司,厦门轮总海上客运旅游有限公司,高速客船,5db847055235e701bc7c1432
2964,1990D0000778,31638,2965,海船,明州58,宁波海运股份有限公司,宁波海运股份有限公司,散货船,5db847055235e701bc7c1433
2965,2004J0000127,990,2966,河船,新平江1020,南京长江油运公司,南京长江油运公司,油船（闪点≤60℃）,5db847055235e701bc7c1434
2966,2015H0000984,847,2967,海船,澄港拖6001,江苏金马运业有限公司,江阴澄港拖轮船务有限公司,普通拖船,5db847055235e701bc7c1435
2967,2016K0000558,1939,2968,河船,苏中油09,江苏苏中油运有限公司,江苏苏中油运有限公司,油船（闪点>60℃）,5db847055235e701bc7c1436
2968,2018J0000598,12788,2969,海船,延展67,厦门延展海运有限公司,厦门象屿金象融资租赁有限公司,集装箱船,5db847055235e701bc7c1437
2969,2.01E+216,996,2970,河船,湘未名006,岳阳安顺船务有限公司,岳阳安顺船务有限公司,油船（闪点≤60℃）,5db847055235e701bc7c1438
2970,2006C0000093,640,2971,河船,苏海事囤58,中华人民共和国南通海事局,中华人民共和国南通海事局,港用囤船,5db847055235e701bc7c1439
2971,1997W0000789,40268,2972,海船,日照鸿运,上海中谷物流股份有限公司,日照港集装箱发展有限公司,集装箱船,5db847055235e701bc7c143a
2972,2013D0000042,2339,2973,河船,东桂11,广西梧州同舟船务运输有限公司,广西梧州同舟船务运输有限公司,化学品液货船,5db847055235e701bc7c143b
2973,2017C0000330,6247,2974,海船,魏桥佳达18,天津佳达船务有限公司,天津佳达船务有限公司,散货船,5db847055235e701bc7c143c
2974,2004L0000152,3918,2975,海船,绪扬7,宁波绪扬海运有限公司,宁波绪扬海运有限公司,油船（闪点≤60℃）,5db847055235e701bc7c143d
2975,2014X0000230,1718,2976,河船,和友6,池州市流坡航运有限责任公司,池州市流坡航运有限责任公司,化学品液货船,5db847055235e701bc7c143e
2976,2013F0000665,2557,2977,海船,海洋石油261,渤海石油航务建筑工程有限责任公司,渤海石油航务建筑工程有限责任公司,打桩船,5db847055235e701bc7c143f
2977,2010N0000599,1139,2978,海船,和顺3,荣成市和顺船务有限公司,荣成市和顺船务有限公司,油船（闪点≤60℃）,5db847055235e701bc7c1440
2978,2008S0000585,2993,2979,海船,圣油225,深圳市海昌华海运股份有限公司,深圳市海昌华海运股份有限公司,油船（闪点≤60℃）,5db847055235e701bc7c1441
2979,2011M0000699,5744,2980,海船,圣油235,深圳市海昌华海运股份有限公司,深圳市海昌华海运股份有限公司,油船（闪点≤60℃）,5db847055235e701bc7c1442
2980,2013N0001063,496,2981,海船,日港拖27,日照港股份有限公司,日照港股份有限公司,普通拖船,5db847055235e701bc7c1443
2981,2005K0000413,9984,2982,海船,云海351,安徽云海航运有限公司,安徽云海航运有限公司,散货船,5db847055235e701bc7c1444
2982,2017T0000575,4509,2983,海船,长狮12,长江重庆航道工程局,长江航道局,绞吸式挖泥船,5db847055235e701bc7c1445
2983,1984E0001024,11144,2984,海船,帝高,帝远股份有限公司,帝远股份有限公司,一般干货船,5db847055235e701bc7c1446
2984,2017F0001391,8467,2985,河船,民快,民生轮船股份有限公司,民生轮船股份有限公司,滚装船,5db847055235e701bc7c1447
2985,2018L0000324,6247,2986,海船,魏桥佳达68,天津惠桥船务有限公司,交银金融租赁有限责任公司,散货船,5db847055235e701bc7c1448
2986,2013X0000957,25155,2987,海船,太平山26,台州市太平海运有限公司,台州市太平海运有限公司等,散货船,5db847055235e701bc7c1449
2987,2010G0000823,2636,2988,海船,涤海12,上海涤海物流有限公司,中远海运租赁有限公司,化学品液货船,5db847055235e701bc7c144a
2988,2013X0000750,8589,2989,海船,永正,海南祥隆船务有限公司,海南祥隆船务有限公司（等两方共有）,客滚船,5db847055235e701bc7c144b
2989,2006Y0000159,147,2990,海船,津航艇30,中交烟台环保疏浚有限公司,中交烟台环保疏浚有限公司,抛锚船,5db847055235e701bc7c144c
2990,2019M0000472,23744,2991,海船,一航津安1,中交第一航务工程局有限公司,中交第一航务工程局有限公司,特殊用途船,5db847055235e701bc7c144d
2991,2011U0000729,2689,2992,河船,祥洲,南京长江油运有限公司,南京长江油运有限公司,油船（闪点>60℃）,5db847055235e701bc7c144e
2992,2012L0000109,7152,2993,海船,紫荆九号,徐闻县海运有限公司,徐闻县海运有限公司,客滚船,5db847055235e701bc7c144f
2993,2012K0000729,383,2994,海船,岛际15,舟山亿洋岛际运输有限公司,舟山亿洋岛际运输有限公司,渡船,5db847055235e701bc7c1450
2994,2013H0000506,3595,2995,河船,远洋9209,重庆市泽胜船务（集团）有限公司,重庆市万州区扬江航运有限公司,化学品液货船,5db847055235e701bc7c1451
2995,2016J0001408,220,2996,海船,洋盛7,嵊泗县洋山港盛渡口客运有限公司,嵊泗县洋山港盛渡口客运有限公司,普通客船,5db847055235e701bc7c1452
2996,2012K0000867,1835,2997,河船,金甲2156,武汉金甲物流有限公司,武汉金甲物流有限公司,油船（闪点≤60℃）,5db847055235e701bc7c1453
2997,2018J0000759,43475,2998,海船,华元20,上海华元航运有限公司,上海华元航运有限公司,散货船,5db847055235e701bc7c1454
2998,1995G0000251,1964,2999,海船,信海6号,海南海峡航运股份有限公司,海南海峡航运股份有限公司,客滚船,5db847055235e701bc7c1455
2999,2013N0000258,436,3000,海船,三航拖2011,中交第三航务工程局有限公司宁波分公司,中交第三航务工程局有限公司,普通拖船,5db847055235e701bc7c1456
3000,2011T0000774,16507,3001,海船,中兴达6,台州市润海船务有限公司,台州市润海船务有限公司等,散货船,5db847075235e701bc7c1457
3001,2007Q0000137,916,3002,河船,鑫盛24,江苏金马运业有限公司,江苏金马运业有限公司,液化气体船/化学品液货船,5db847075235e701bc7c1458
3002,2009X3101068,907,3003,海船,民生601,天津市旭日海运有限公司,民生金融租赁股份有限公司,供应船,5db847075235e701bc7c1459
3003,2014D0000718,2368,3004,河船,鑫惠1号,宜昌鑫汇船舶修造有限公司,宜昌鑫汇船舶修造有限公司,化学品液货船,5db847075235e701bc7c145a
3004,2017J0000313,2834,3005,河船,华阳58,泰州市华通船务有限公司,泰州市华通船务有限公司,油船（闪点>60℃）,5db847075235e701bc7c145b
3005,2009E0000375,962,3006,河船,长轮36027,中石化长江燃料有限公司岳阳分公司,中石化长江燃料有限公司,油囤,5db847075235e701bc7c145c
3006,2014J0000194,29141,3007,海船,神华533,神华中海航运有限公司,神华中海航运有限公司,散货船,5db847075235e701bc7c145d
3007,2016C0000413,492,3008,海船,海神01,长岛渤海映华海上游有限公司,长岛渤海映华海上游有限公司,普通客船,5db847075235e701bc7c145e
3008,2013U0000517,28751,3009,海船,华润电力7,天津中海华润航运有限公司,天津中海华润航运有限公司,散货船,5db847075235e701bc7c145f
3009,2010M0000161,2475,3010,海船,天恩璐66,天恩璐（大连）航运有限公司,天恩璐（大连）航运有限公司,三用拖船,5db847075235e701bc7c1460
3010,2015S0000763,2935,3011,海船,新润15,天津麦道科技有限公司,天津麦道科技有限公司,甲板货船,5db847075235e701bc7c1461
3011,2018P0000189,430,3012,海船,嘉港拖11,浙江嘉兴港口服务集团有限公司,嘉兴市港务管理局,普通拖船,5db847075235e701bc7c1462
3012,2017H0000795,8911,3013,河船,华嘉6号,重庆华阳嘉川船务有限公司,重庆华阳嘉川船务有限公司,滚装船,5db847075235e701bc7c1463
3013,2016Q0000126,493,3014,海船,海港118,上海深水港船务有限公司,上海深水港船务有限公司,普通拖船,5db847075235e701bc7c1464
