,CJDJH,GROSS,ROWNUM_,SEA_INLAND,SHIPNAME_CN,SHIP_OPERATOR,SHIP_OWNER,SPTYPE,_id
1010,2008Y0000269,3453,1011,河船,长江粮运29,四川长江粮运有限公司,中航国际租赁有限公司,散货船,5db846ec5235e701bc7c0c91
1011,2009A0000509,3038,1012,河船,长江粮运101,四川长江粮运有限公司,中航国际租赁有限公司,散货船,5db846ec5235e701bc7c0c92
1012,2014J0000355,1599,1013,河船,皖港油26,,安庆港油运船务有限责任公司,油船（闪点≤60℃）,5db846ec5235e701bc7c0c93
1013,2010H0001169,22481,1014,海船,力达盛,泉州力达船务有限公司,泉州力达船务有限公司,散货船,5db846ec5235e701bc7c0c94
1014,2016J0000626,4604,1015,海船,五洲105,连云港启顺海运有限公司,连云港启顺海运有限公司,集装箱船,5db846ec5235e701bc7c0c95
1015,2018F0000066,27,1016,海船,东海救311,交通运输部东海救助局,交通运输部东海救助局,辅助船,5db846ec5235e701bc7c0c96
1016,2005V0000285,3759,1017,河船,民享,民生轮船股份有限公司,民生轮船股份有限公司,集装箱船,5db846ec5235e701bc7c0c97
1017,2011B0000091,16507,1018,海船,汇鑫3,嘉兴汇鑫海运发展有限公司,嘉兴汇鑫海运发展有限公司,散货船,5db846ec5235e701bc7c0c98
1018,1994U0000783,14581,1019,海船,中港永和,南京中港船业有限公司,南京中港船业有限公司,油船（闪点≤60℃）,5db846ec5235e701bc7c0c99
1019,2010D0000682,12806,1020,海船,联合17,宁波远洋运输有限公司,宁波远洋运输有限公司,散货船,5db846ec5235e701bc7c0c9a
1020,2011D0000254,5496,1021,河船,长航集运0328,重庆长航天一物流有限公司,交银金融租赁有限责任公司,集装箱船,5db846ec5235e701bc7c0c9b
1021,2009X4300127,1399,1022,海船,深科拖9,天津市浩驰海洋工程有限公司,天津市浩驰海洋工程有限公司,三用拖船,5db846ec5235e701bc7c0c9c
1022,2015P0000553,2554,1023,河船,赛福特5018,,,化学品液货船,5db846ec5235e701bc7c0c9d
1023,2009N0000199,270,1024,海船,津航艇35,中交烟台环保疏浚有限公司,中交烟台环保疏浚有限公司,抛锚船,5db846ec5235e701bc7c0c9e
1024,2017Q0000917,497,1025,海船,海港122,上海深水港船务有限公司,上海深水港船务有限公司,普通拖船,5db846ec5235e701bc7c0c9f
1025,2011E0000853,2999,1026,海船,恒晖29,浙江恒晖海运有限公司,浙江恒晖海运有限公司,油船（闪点≤60℃）,5db846ec5235e701bc7c0ca0
1026,3000U0002776,3057,1027,河船,金甲5688,武汉金甲物流有限公司,武汉金甲物流有限公司,化学品液货船,5db846ec5235e701bc7c0ca1
1027,2012D0000079,357,1028,河船,江城10号,武汉市轮渡公司,武汉市轮渡公司,客渡船,5db846ec5235e701bc7c0ca2
1028,1983J5100717,1670,1029,海船,春兴一号,深圳市佳酉船务有限公司,深圳市佳酉船务有限公司,油船（闪点≤60℃）,5db846ec5235e701bc7c0ca3
1029,2013W0000013,38384,1030,海船,鹏安,深圳远洋运输股份有限公司,深圳远洋运输股份有限公司,散货船,5db846ec5235e701bc7c0ca4
1030,2014B0000923,9466,1031,河船,民联号,民生轮船股份有限公司,上海民生轮船有限公司,滚装船,5db846ec5235e701bc7c0ca5
1031,2006X0000342,2725,1032,海船,海神浚,上海乐浚船务工程有限公司,上海乐浚船务工程有限公司,绞吸式挖泥船,5db846ec5235e701bc7c0ca6
1032,2013U0000310,2951,1033,海船,恒晖25,浙江恒晖海运有限公司,浙江恒晖海运有限公司,油船（闪点≤60℃）,5db846ec5235e701bc7c0ca7
1033,1993J0000511,995,1034,海船,紫荆三号,广东徐闻港航控股有限公司,广东徐闻港航控股有限公司,Ⅲ级客滚船,5db846ec5235e701bc7c0ca8
1034,2014H0000147,10940,1035,海船,铜鼓岭,海南海峡航运股份有限公司,海南海峡航运股份有限公司,客滚船,5db846ec5235e701bc7c0ca9
1035,2008F0000229,3193,1036,海船,通达3,岱山县蓬莱客运轮船有限公司,舟山海峡轮渡集团有限公司,客滚船,5db846ec5235e701bc7c0caa
1036,1995Q0000213,910,1037,海船,大庆223,广州海运物资供应公司,广州海运物资供应公司,油船(F.P.>60℃),5db846ec5235e701bc7c0cab
1037,2011L0000008,18382,1038,海船,长兴洲,中国长江航运集团南京油运股份有限公司,中国长江航运集团南京油运股份有限公司,油船（闪点≤60℃）,5db846ec5235e701bc7c0cac
1038,2012N0001353,2942,1039,海船,常丰油2,长岛常丰油轮运输有限公司,长岛常丰油轮运输有限公司,油船（闪点≤60℃）,5db846ec5235e701bc7c0cad
1039,2010C0000060,4175,1040,河船,港盛1003,重庆港盛欣陵船务有限公司,重庆港盛船务有限公司,集装箱船,5db846ec5235e701bc7c0cae
1040,2013M0000671,2512,1041,河船,新长江25041,长航货运有限公司,工银金融租赁有限公司,散货船,5db846ec5235e701bc7c0caf
1041,2000P0000418,38684,1042,海船,中安洋,福建中航海运有限公司,福建中航海运有限公司,散货船,5db846ec5235e701bc7c0cb0
1042,2010S0000281,1215,1043,海船,东远501,山东远达船舶股份有限公司,山东远达船舶股份有限公司,供应船,5db846ec5235e701bc7c0cb1
1043,1989S0000782,23454,1044,海船,明州27,宁波海运股份有限公司,宁波海运股份有限公司,散货船,5db846ec5235e701bc7c0cb2
1044,2.01E+115,4266,1045,海船,运通168,莱州市运通海运有限公司,莱州市运通海运有限公司及韩伟涛,油船（闪点≤60℃）,5db846ec5235e701bc7c0cb3
1045,2012Q0000297,2623,1046,海船,晟荣18,浙江晟荣船务有限公司,浙江晟荣船务有限公司,油船（闪点≤60℃）,5db846ec5235e701bc7c0cb4
1046,2016N0000147,483,1047,海船,金威5,庄河金威海上客运公司,庄河金威海上客运公司,普通客船,5db846ec5235e701bc7c0cb5
1047,2014A0000186,459,1048,海船,厦港拖21,厦门港务船务有限公司,厦门港务船务有限公司,普通拖船,5db846ec5235e701bc7c0cb6
1048,1986F0000008,996,1049,海船,华海102,常州华海船务有限公司,常州华海船务有限公司,化学品液货船,5db846ec5235e701bc7c0cb7
1049,2013G0000137,4127,1050,海船,华盛油122,温州华顺船务有限公司,温州华顺船务有限公司,油船（闪点≤60℃）,5db846ec5235e701bc7c0cb8
1050,2015X3100156,10089,1051,海船,南辉82,福建南辉轮船有限公司,福建南辉轮船有限公司,多用途船,5db846ec5235e701bc7c0cb9
1051,2019C0000026,94,1052,海船,海电运维201,福建海上风电运维服务有限公司,福建海上风电运维服务有限公司,小艇,5db846ec5235e701bc7c0cba
1052,2013J0000760,2741,1053,海船,运达油9,深圳运达海运有限公司,深圳运达海运有限公司,油船（闪点≤60℃）,5db846ec5235e701bc7c0cbb
1053,2018S0000606,3594,1054,河船,龙川9,武汉海通船舶运输有限公司,武汉海通船舶运输有限公司,油船（闪点≤60℃）,5db846ec5235e701bc7c0cbc
1054,2015Q0000140,432,1055,海船,龙发18号,三亚云宿海上旅游发展有限公司,三亚云宿海上旅游发展有限公司,高速客船,5db846ec5235e701bc7c0cbd
1055,2006D0000278,438,1056,河船,苏海事囤23＃,镇江海事局,镇江海事局,港用囤船,5db846ec5235e701bc7c0cbe
1056,2006H0000098,427,1057,海船,海南炼化拖1,中国石化海南炼油化工有限公司,中国石化海南炼油化工有限公司,拖（推）船,5db846ec5235e701bc7c0cbf
1057,2008F0000252,404,1058,河船,长燃52,中石化长江燃料有限公司,中石化长江燃料有限公司,油船（闪点>60℃）,5db846ec5235e701bc7c0cc0
1058,2006D0000025,6701,1059,河船,江航8,重庆鸿富船务有限公司,重庆鸿富船务有限公司,客滚船（Ⅱ型）,5db846ec5235e701bc7c0cc1
1059,1994V0000255,775,1060,海船,海虹一号,海南海峡航运股份有限公司,海南海峡航运股份有限公司,III级客船,5db846ec5235e701bc7c0cc2
1060,2009E0000444,11585,1061,海船,棋子湾,海南海峡航运股份有限公司,海南海峡航运股份有限公司,客滚船,5db846ec5235e701bc7c0cc3
1061,2009L0000220,2695,1062,海船,天凤,中交天航港湾建设工程有限公司,昆仑金融租赁有限责任公司,绞吸式挖泥船,5db846ec5235e701bc7c0cc4
1062,2013N0000695,31663,1063,海船,新海通3,福建海通发展股份有限公司,民生金融租赁股份有限公司,散货船,5db846ec5235e701bc7c0cc5
1063,2012X0000603,2537,1064,海船,中燃37,中国船舶燃料广州有限公司,中国船舶燃料广州有限公司,油船（闪点>60℃）,5db846ec5235e701bc7c0cc6
1064,2009L0000358,10650,1065,河船,凯珍,重庆市东江实业有限公司,四川金石租赁股份有限公司,长江涉外旅游客船,5db846ec5235e701bc7c0cc7
1065,2007G0000313,2382,1066,海船,集海之绣,上海集海航运有限公司,上海集海航运有限公司,集装箱船,5db846ec5235e701bc7c0cc8
1066,2004B0000557,46466,1067,海船,中联86,安徽中联海运有限公司,安徽中联海运有限公司,散货船,5db846ec5235e701bc7c0cc9
1067,3000D0000829,650,1068,河船,绿动1007,,,一般干货船,5db846ec5235e701bc7c0cca
1068,2011T0000935,16504,1069,海船,中兴达97,浙江中一海运有限公司,梁如华、梁如根,散货船,5db846ec5235e701bc7c0ccb
1069,2013J0000300,2984,1070,海船,海雄油3,广东海雄油运有限公司,广东海雄油运有限公司,油船（闪点≤60℃）,5db846ec5235e701bc7c0ccc
1070,2013D0000249,585,1071,河船,江苏8012,南京江海轮运有限公司,南京江海轮运有限公司,化学品液货船,5db846ec5235e701bc7c0ccd
1071,2017K0001073,595,1072,海船,中国海监303,国家海洋局汕尾海洋环境监测中心站,国家海洋局南海分局,科学调查船,5db846ec5235e701bc7c0cce
1072,2003H0000416,990,1073,河船,新平江1002,南京长江油运有限公司,南京长江油运有限公司,油船（闪点≤60℃）,5db846ec5235e701bc7c0ccf
1073,3000P0001690,20,1074,海船,13.9-13,,福建毅宏游艇股份有限公司,游艇（12人及以下）,5db846ec5235e701bc7c0cd0
1074,2004C0000236,990,1075,河船,新平江1026,南京长江油运物流有限公司,南京长江油运物流有限公司,油船,5db846ec5235e701bc7c0cd1
1075,2010Y0000333,1356,1076,海船,海宏航工壹号,江苏海宏建设工程有限公司,江苏海宏建设工程有限公司,工程船,5db846ec5235e701bc7c0cd2
1076,2004R0000226,990,1077,河船,新平江1016,南京长江油运有限公司,南京长江油运有限公司,油船（闪点≤60℃）,5db846ec5235e701bc7c0cd3
1077,2014J0000470,385,1078,海船,飞舟16,浙江省舟山市通达高速客轮有限公司,浙江省舟山市通达高速客轮有限公司,高速客船,5db846ec5235e701bc7c0cd4
1078,1987R0000878,24389,1079,海船,安平6,中海散货运输有限公司,中海散货运输有限公司,散货船,5db846ec5235e701bc7c0cd5
1079,2006J0000053,721,1080,海船,云港驳501,连云港港口集团有限公司轮驳分公司,连云港港口集团有限公司,运泥船,5db846ec5235e701bc7c0cd6
1080,2006F0000211,396,1081,海船,海港35,上海港复兴船务有限公司,上海港复兴船务有限公司,普通拖船,5db846ec5235e701bc7c0cd7
1081,2005L0000437,409,1082,海船,盐港拖10,深圳盐田拖轮有限公司,深圳盐田拖轮有限公司,普通拖船,5db846ec5235e701bc7c0cd8
1082,2011K0000835,5335,1083,海船,奥通2,石狮市奥通商运有限公司,石狮市奥通商运有限公司,多用途船,5db846ec5235e701bc7c0cd9
1083,2013V0000058,2950,1084,海船,宁远16,湛江市海富船务有限公司,湛江市海富船务有限公司等,油船（闪点≤60℃）,5db846ec5235e701bc7c0cda
1084,2006E3300181,3272,1085,海船,擎都17号,永修县航运有限公司,永修县航运有限公司,油船（闪点≤60℃）,5db846ec5235e701bc7c0cdb
1085,2015M0000114,20117,1086,海船,华盛达,洋浦通利船务有限公司,洋浦通利船务有限公司,散货船,5db846ec5235e701bc7c0cdc
1086,3000L0000422,9174,1087,河船,华嘉11号,重庆华阳嘉川船务有限公司,重庆华阳嘉川船务有限公司,滚装船,5db846ec5235e701bc7c0cdd
1087,2002K0000432,40041,1088,海船,信风扬子江,信风（宁波）海运物流有限公司,中航国际租赁有限公司,集装箱船,5db846ec5235e701bc7c0cde
1088,2006J0000007,6487,1089,海船,长丰海,长航货运有限公司,长航货运有限公司,散货船,5db846ec5235e701bc7c0cdf
1089,2011V0000270,398,1090,海船,石港拖17,石岛新港港务股份有限公司,石岛新港港务股份有限公司,普通拖船,5db846ec5235e701bc7c0ce0
1090,2014Q0000200,1483,1091,河船,皖江16,安徽省皖江轮船运输有限公司,安徽省皖江轮船运输有限公司,化学品液货船,5db846ec5235e701bc7c0ce1
1091,2015E0001441,4187,1092,河船,华丰8号,重庆大裕船务有限公司,重庆金纳船务有限公司,散货船,5db846ec5235e701bc7c0ce2
1092,1985K0000877,993,1093,海船,久隆9,广西振海船务有限公司,广西振海船务有限公司等贰公司,液化气体船,5db846ec5235e701bc7c0ce3
1093,2004P0000247,990,1094,河船,新平江1029,南京长江油运有限公司,南京长江油运有限公司,油船（闪点≤60℃）,5db846ec5235e701bc7c0ce4
1094,2010H0000387,8328,1095,海船,盛达3,福建盛达船务有限公司,福建盛达船务有限公司、福州融海航运有限公司,散货船,5db846ec5235e701bc7c0ce5
1095,2019S0000270,2992,1096,河船,泰和001,江苏泰和船务有限公司,江苏泰和船务有限公司,化学品液货船,5db846ec5235e701bc7c0ce6
1096,2010K0000872,2226,1097,海船,天恩璐77,天恩璐（大连）航运有限公司,天恩璐（大连）航运有限公司,三用拖船,5db846ec5235e701bc7c0ce7
1097,2012N0000548,1589,1098,河船,通达化0066,江西通达航运股份有限公司,江西通达航运股份有限公司,化学品液货船,5db846ec5235e701bc7c0ce8
1098,2019N0000174,395,1099,海船,六横之星1,舟山市普陀区六横运输总公司,舟山市普陀区六横运输总公司,高速客船,5db846ec5235e701bc7c0ce9
1099,2005M0000346,550,1100,海船,长航洋山3001,上海新洋山集装箱运输有限公司,上海新洋山集装箱运输有限公司,顶推船D驳船组合体-驳船,5db846ec5235e701bc7c0cea
1100,2013F0000182,998,1101,河船,湘金和108,湖南金和石油实业有限公司,湖南金和石油实业有限公司,油船（闪点≤60℃）,5db846ed5235e701bc7c0ceb
1101,2013F0000251,12924,1102,河船,总统七号,武汉扬子江游船有限公司,武汉扬子江游船有限公司,长江涉外旅游客船,5db846ed5235e701bc7c0cec
1102,2002L0000410,460,1103,海船,北游18,北海新绎游船有限公司,北海新绎游船有限公司,高速客船,5db846ed5235e701bc7c0ced
1103,2009L0000036,989,1104,河船,珞电1号,华能重庆珞璜发电有限责任公司,华能重庆珞璜发电有限责任公司,起重囤船,5db846ed5235e701bc7c0cee
1104,2012M0000915,2512,1105,河船,新长江25061,长航货运有限公司,长航货运有限公司,散货船,5db846ed5235e701bc7c0cef
1105,2012F0001070,499,1106,海船,神华拖9,神华黄骅港务有限责任公司,神华黄骅港务有限责任公司,普通拖船,5db846ed5235e701bc7c0cf0
1106,1990Q0000789,35890,1107,海船,协海永盛,舟山协海航运有限公司,吴周强,散货船,5db846ed5235e701bc7c0cf1
1107,2013N0000603,29152,1108,海船,神华503,神华中海航运有限公司,神华中海航运有限公司,散货船,5db846ed5235e701bc7c0cf2
1108,2011P0000816,5169,1109,海船,和海7,南京江海油运有限责任公司,江苏和海油品运输有限公司,油船（闪点≤60℃）,5db846ed5235e701bc7c0cf3
1109,2011X0000088,5545,1110,河船,港盛1501,重庆港盛船务有限公司,重庆港盛船务有限公司,集装箱船,5db846ed5235e701bc7c0cf4
1110,2014J0000309,2233,1111,河船,欣华欣131,重庆江顺航运有限公司,重庆江顺航运有限公司,化学品液货船,5db846ed5235e701bc7c0cf5
1111,2005R0000212,3678,1112,河船,万港907,重庆市澜腾运输有限公司,万州区太白路185号B栋27-3；王万发,集装箱船,5db846ed5235e701bc7c0cf6
1112,2018G0000205,88,1113,海船,北海救321,交通运输部北海救助局,交通运输部北海救助局,辅助船,5db846ed5235e701bc7c0cf7
1113,2007G0000083,3440,1114,海船,长洋驳4,上海新洋山集装箱运输有限公司,上海新洋山集装箱运输有限公司,集装箱驳,5db846ed5235e701bc7c0cf8
1114,2005G0000180,1077,1115,海船,胜利242,中国石油化工股份有限公司胜利油田分公司海洋石油船舶中心,中国石油化工股份有限公司,普通拖船,5db846ed5235e701bc7c0cf9
1115,3000D0000691,596,1116,海船,中国海监103,国家海洋局北海分局,国家海洋局北海分局,科学调查船,5db846ed5235e701bc7c0cfa
1116,2.01E+97,5028,1117,海船,鲲翔2,南京鲲翔船务有限公司,南京鲲翔船务有限公司,油船（闪点≤60℃）,5db846ed5235e701bc7c0cfb
1117,2.01E+97,5028,1118,海船,鲲翔2,南京鲲翔船务有限公司,南京鲲翔船务有限公司,油船（闪点≤60℃）,5db846ed5235e701bc7c0cfc
1118,2007N0000043,3938,1119,河船,苏润江7001,江苏苏能物流航运有限公司,镇江华源投资有限公司,散货船,5db846ed5235e701bc7c0cfd
1119,2013U0000241,8291,1120,河船,长航江康,长航武汉汽车物流有限公司,长航武汉汽车物流有限公司,滚装船,5db846ed5235e701bc7c0cfe
1120,2009G0000400,1256,1121,海船,海工001,张家港海盛船舶修造有限公司,徐训高,绞吸式挖泥船,5db846ed5235e701bc7c0cff
1121,2012K0001281,2951,1122,海船,恒帆17,舟山日N昌海运有限公司,舟山日N昌海运有限公司,油船（闪点≤60℃）,5db846ed5235e701bc7c0d00
1122,2015C0001393,407,1123,河船,绿动6032,-,-,一般干货船,5db846ed5235e701bc7c0d01
1123,2012C0000193,2123,1124,河船,新平江3002,南京长江油运有限公司,招银金融租赁有限公司,油船（闪点≤60℃）,5db846ed5235e701bc7c0d02
1124,3000N0001689,20,1125,海船,13.9-10,,福建毅宏游艇股份有限公司,游艇（12人及以下）,5db846ed5235e701bc7c0d03
1125,1986U0000941,15657,1126,海船,明州6,宁波海运股份有限公司,宁波海运股份有限公司,散货船,5db846ed5235e701bc7c0d04
1126,1996G0000812,25987,1127,海船,国电8,天津国电海运有限公司,建信金融租赁有限公司,散货船,5db846ed5235e701bc7c0d05
1127,2013C0000984,9224,1128,海船,紫荆十二号,广东徐闻港航控股有限公司,广东徐闻港航控股有限公司,客滚船,5db846ed5235e701bc7c0d06
1128,2019X0000275,11,1129,海船,中国海关3103,中华人民共和国广州海关缉私局,中华人民共和国广州海关,巡逻船,5db846ed5235e701bc7c0d07
1129,2016M0001250,6653,1130,海船,博大35,象山兴宁航运有限公司,宁波博大船业有限公司,集装箱船,5db846ed5235e701bc7c0d08
1130,2011X0000479,7386,1131,海船,浙海油3,浙江海洋石化运输有限公司,浙江海洋石化运输有限公司,油船（闪点≤60℃）,5db846ed5235e701bc7c0d09
1131,2019N0000519,2327,1132,海船,长鹰8,,长江航道局,铲斗式挖泥船,5db846ed5235e701bc7c0d0a
1132,2014W0000666,637,1133,海船,鹭江之星,厦门湾海上旅游客运有限公司,厦门湾海上旅游客运有限公司,普通客船,5db846ed5235e701bc7c0d0b
1133,3000S0000336,920,1134,河船,深能621,贵州深能航运股份有限公司,贵州深能航运股份有限公司,集装箱船,5db846ed5235e701bc7c0d0c
1134,3000F0001521,19685,1135,海船,W1612,,,化学品液货船,5db846ed5235e701bc7c0d0d
1135,2008N0000052,34,1136,河船,航迅2,长江南京航道局,长江南京航道局,测量船,5db846ed5235e701bc7c0d0e
1136,2012M0001260,459,1137,海船,威港拖31,威海港盛轮驳有限公司,山东威海港股份有限公司,普通拖船,5db846ed5235e701bc7c0d0f
1137,2012A0001111,2950,1138,海船,永丰达1,浙江永丰达海运有限公司,浙江永丰达海运有限公司,油船（闪点≤60℃）,5db846ed5235e701bc7c0d10
1138,2007D0000149,9692,1139,海船,长安门,天津两江海运有限公司,天津两江海运有限公司,散货船,5db846ed5235e701bc7c0d11
1139,2014B0000233,5,1140,海船,翔州1,中船重工（海南）飞船发展有限公司,中船重工（海南）飞船发展有限公司,地效翼客船,5db846ed5235e701bc7c0d12
1140,2014B0000302,3769,1141,河船,新长江06011,长航货运有限公司,交银金融租赁有限责任公司,散货船,5db846ed5235e701bc7c0d13
1141,2016U0000659,3690,1142,海船,长鲸8,长江重庆航道工程局,长江重庆航道工程局,耙吸式挖泥船,5db846ed5235e701bc7c0d14
1142,2014F0000881,31,1143,河船,湄老004,商务部国际经济合作事务局,商务部国际经济合作事务局,巡逻船,5db846ed5235e701bc7c0d15
1143,2002Y0000146,6796,1144,海船,海科102,江苏泛洲船务有限公司,泰兴市海坤商贸有限公司,散货船,5db846ed5235e701bc7c0d16
1144,2018G0000734,2996,1145,海船,大安28,湛江市大安水运有限公司,湛江市大安水运有限公司,油船（闪点≤60℃）,5db846ed5235e701bc7c0d17
1145,2012V0000026,2987,1146,海船,际翔7,浙江际翔海运有限公司,浙江际翔海运有限公司,油船（闪点≤60℃）,5db846ed5235e701bc7c0d18
1146,2013P0000006,31893,1147,海船,鹏泰,深圳远洋运输股份有限公司,深圳远洋运输股份有限公司,散货船,5db846ed5235e701bc7c0d19
1147,2019C0000325,180,1148,海船,海电运维302,福建海上风电运维服务有限公司,福建海上风电运维服务有限公司,辅助船,5db846ed5235e701bc7c0d1a
1148,2014V0000320,2995,1149,海船,东海215,宁波东海海运有限公司,中远海运租赁有限公司,油船（闪点≤60℃）,5db846ed5235e701bc7c0d1b
1149,2012U0000416,474,1150,海船,安东21,丹东港集团有限公司,华融金融租赁股份有限公司,普通拖船,5db846ed5235e701bc7c0d1c
1150,2011R0001370,21898,1151,海船,海隆达,常熟海隆航运有限公司,常熟海隆航运有限公司,散货船,5db846ed5235e701bc7c0d1d
1151,2011S0000911,378,1152,海船,威港拖29,山东威海港股份有限公司,山东威海港股份有限公司,普通拖船,5db846ed5235e701bc7c0d1e
1152,2009J0000241,16469,1153,海船,全强吉祥,淮安胜航航运有限公司,淮安胜航航运有限公司,散货船,5db846ed5235e701bc7c0d1f
1153,2019Q0000038,386,1154,河船,长燃65,中石化长江燃料有限公司南京分公司,中石化长江燃料有限公司,油船（闪点>60℃）,5db846ed5235e701bc7c0d20
1154,1992K0000503,802,1155,海船,徐运207,广东双泰运输集团有限责任公司,广东双泰运输集团有限责任公司,Ⅲ级客滚船,5db846ed5235e701bc7c0d21
1155,2010W0000814,27629,1156,海船,长航和海,长航货运有限公司,交银金融租赁有限责任公司,散货船,5db846ed5235e701bc7c0d22
1156,2016R0000150,2242,1157,河船,联兴3001,广西邕江资产管理有限公司,广西邕江资产管理有限公司,集装箱船,5db846ed5235e701bc7c0d23
1157,2013J0000783,3892,1158,海船,新富源8,舟山富源船务有限公司,舟山富源船务有限公司,油船（闪点≤60℃）,5db846ed5235e701bc7c0d24
1158,2015Y0000516,11593,1159,海船,恒力11,恒力海运（大连）有限公司,恒力海运（大连）有限公司,散货船,5db846ed5235e701bc7c0d25
1159,2004Y0000233,1469,1160,河船,新平江1025,南京长江油运有限公司,南京长江油运有限公司,油船（闪点≤60℃）,5db846ed5235e701bc7c0d26
1160,2012C0000837,2512,1161,河船,新长江25005,长航货运有限公司,工银金融租赁有限公司,散货船,5db846ed5235e701bc7c0d27
1161,2013P0000880,2588,1162,河船,清江号,南京华航沥青运输有限公司,高淳县宁高石油运输有限责任公司、湖南金和石油实业有限公司,油船（闪点≤60℃）,5db846ed5235e701bc7c0d28
1162,3000U0000752,,1163,河船,西蓝长江1号,湖北西蓝天然气有限公司,湖北西蓝天然气有限公司,港用囤船,5db846ed5235e701bc7c0d29
1163,2017D0000285,44426,1164,海船,中外运渤海,中国外运阳光速航运输有限公司,中国外运阳光速航运输有限公司,集装箱船,5db846ed5235e701bc7c0d2a
1164,1999J0000772,24724,1165,海船,新瓯19,上海新瓯海运有限公司,上海新瓯海运有限公司等,集装箱船,5db846ed5235e701bc7c0d2b
1165,2011J0000742,15579,1166,海船,宝航18,上海宝钢航运有限公司,上海宝钢航运有限公司,散货船,5db846ed5235e701bc7c0d2c
1166,2015G0001144,2172,1167,海船,舟海供5,浙江新润海运有限公司,浙江新润海运有限公司,供应船,5db846ed5235e701bc7c0d2d
1167,2004R0000134,990,1168,河船,新平江1022,南京长江油运有限公司,南京长江油运有限公司,油船（闪点≤60℃）,5db846ed5235e701bc7c0d2e
1168,1998N0000399,1428,1169,海船,胜利614,中国石油化工股份有限公司胜利油田分公司海洋石油船舶中心,中国石油化工股份有限公司,油船（闪点>60℃）,5db846ed5235e701bc7c0d2f
1169,2014U0000158,24398,1170,海船,协海启航,舟山协海航运有限公司,华融华稳（舟山）船舶租赁有限公司,散货船,5db846ed5235e701bc7c0d30
1170,2006S0000061,864,1171,海船,航供油1003,上海航道物流有限公司,上海航道物流有限公司,油船（闪点>60℃）,5db846ed5235e701bc7c0d31
1171,2016D0001357,5601,1172,河船,铭佳1301,重庆铭佳轮船有限公司,重庆铭佳轮船有限公司,多用途船,5db846ed5235e701bc7c0d32
1172,2016Q0000149,492,1173,海船,海汇5,大连海汇客运有限公司,大连海汇客运有限公司,客滚船,5db846ed5235e701bc7c0d33
1173,2012S0001012,30421,1174,海船,国电21,天津国电海运有限公司,北银金融租赁有限公司,散货船,5db846ed5235e701bc7c0d34
1174,2019E0000419,449,1175,海船,和达拖7,浙江和达海运股份有限公司,浙江和达海运股份有限公司,普通拖船,5db846ed5235e701bc7c0d35
1175,3000E0002210,11934,1176,海船,江海直达1140标准箱集装箱示范船,武汉新港长海国际集装箱航运有限公司,武汉新港长海国际集装箱航运有限公司,集装箱船,5db846ed5235e701bc7c0d36
1176,2010C0000244,8531,1177,海船,昆仑油106,中远海运石油运输有限公司,中远海运石油运输有限公司,油船（闪点≤60℃）,5db846ed5235e701bc7c0d37
