,CJDJH,GROSS,ROWNUM_,SEA_INLAND,SHIPNAME_CN,SHIP_OPERATOR,SHIP_OWNER,SPTYPE,_id
0,2015N0001219,2548,,海船,中燃38,中燃航运（大连）有限责任公司,中燃航运（大连）有限责任公司,油船（闪点>60℃）,5db846de5235e701bc7c089f
1,2006B0000023,2339,,海船,丰永1号,湛江市华翔建设工程有限公司,湛江市华翔建设工程有限公司,绞吸式挖泥船,5db846de5235e701bc7c08a0
2,2005N0000301,236,,海船,海巡1003,钦州海事局,钦州海事局,巡逻船,5db846de5235e701bc7c08a1
3,2011F0000946,5545,,河船,港盛1505,重庆港盛船务有限公司,重庆港盛船务有限公司,集装箱船,5db846de5235e701bc7c08a2
4,2008B0000248,346,,海船,宝陀,舟山海星轮船有限公司,舟山海星轮船有限公司,高速客船,5db846de5235e701bc7c08a3
5,2013S0000699,778,,海船,丹港环1,丹东港集团有限公司,丹东港集团有限公司,溢油(污油)回收船,5db846de5235e701bc7c08a4
6,2005D0000361,1593,,河船,安吉806,四川省宜宾五粮液集团安吉物流航运有限责任公司,四川省宜宾五粮液集团安吉物流航运有限责任公司,集装箱船,5db846de5235e701bc7c08a5
7,2016B0000067,2736,,河船,文军2,江苏程顺船务有限责任公司,江苏程顺船务有限责任公司,化学品液货船,5db846de5235e701bc7c08a6
8,2012J0000038,6235,,海船,海德油9,大连德利海运有限公司,大连德利海运有限公司,油船（闪点≤60℃）,5db846de5235e701bc7c08a7
9,2016M0000284,101,,海船,唐山湾15,唐山湾国际旅游岛旅游发展有限公司,唐山湾国际旅游岛旅游发展有限公司,高速客船,5db846de5235e701bc7c08a8
10,2013Q0000720,2983,,海船,富海油3,广西振海船务有限公司,珠海市旺通船务有限公司,油船（闪点≤60℃）,5db846de5235e701bc7c08a9
11,2010C0000589,33511,,海船,新世纪188,神华中海航运有限公司,神华中海航运有限公司,散货船,5db846de5235e701bc7c08aa
12,2010M0000529,15819,,海船,浙海157,浙江省海运集团有限公司,交银金融租赁有限责任公司,散货船,5db846de5235e701bc7c08ab
13,2016R0000334,446,,海船,连船5,大连船舶重工集团有限公司,大连船舶重工集团有限公司,普通拖船,5db846de5235e701bc7c08ac
14,2011W5100130,15,,海船,中国海关3036,中华人民共和国江门海关,中华人民共和国江门海关,巡逻船,5db846de5235e701bc7c08ad
15,2019T0000524,369,,海船,浙港航巡1101,舟山市港航管理局,舟山市港航管理局,巡逻船,5db846de5235e701bc7c08ae
16,2007Q0000114,414,,海船,北部湾拖9,北部湾拖船（防城港）有限公司,北部湾拖船（防城港）有限公司,普通拖船,5db846de5235e701bc7c08af
17,2007G0000290,2256,,海船,远东荣盛,惠州华亿荣盛船务有限公司,天津信原融资租赁有限公司,化学品液货船,5db846de5235e701bc7c08b0
18,2016E0001427,169,,海船,古崎洲1号,海南蜈支洲旅游开发股份有限公司,海南蜈支洲旅游开发股份有限公司,港用囤船,5db846de5235e701bc7c08b1
19,2012M0000938,2952,,海船,国扬67,-,-,油船（闪点≤60℃）,5db846de5235e701bc7c08b2
20,2009T0000043,367,,河船,振华拖19,上海振华重工（集团）股份有限公司,上海振华重工（集团）股份有限公司,普通拖船,5db846de5235e701bc7c08b3
21,2002H0000085,6785,,海船,粤骅,神华中海航运有限公司,神华中海航运有限公司,散货船,5db846de5235e701bc7c08b4
22,2013D0000295,2325,,河船,振兴油98号,九江振鑫船务有限公司,九江振鑫船务有限公司,油船（闪点≤60℃）,5db846de5235e701bc7c08b5
23,2001K0000193,1723,,河船,民康,宜昌民康船务有限责任公司,宜昌民康船务有限责任公司,川江滚装船,5db846de5235e701bc7c08b6
24,2015L0000826,2709,,河船,华通油78,泰州市华通船务有限公司,泰州市华通船务有限公司,油船（闪点≤60℃）,5db846de5235e701bc7c08b7
25,2010J0000342,2147,,海船,民龙6001,舟山市泓宇海运有限公司,舟山市泓宇海运有限公司,供应船,5db846de5235e701bc7c08b8
26,2007G0000428,5399,,海船,康海裕洋,南通康海船务有限公司,南通康海船务有限公司,散货船,5db846de5235e701bc7c08b9
27,2011Q0000403,3934,,海船,华瑞55,华瑞物流股份有限公司,华瑞物流股份有限公司,一般干货船,5db846de5235e701bc7c08ba
28,2009F0000284,15824,,海船,长恒海,武汉长航新凤凰物流有限责任公司,武汉长航新凤凰物流有限责任公司,散货船,5db846de5235e701bc7c08bb
29,2007X0000052,3748,,海船,集海之明,上海集海航运有限公司,上海集海航运有限公司,集装箱船,5db846de5235e701bc7c08bc
30,2007L0000087,3353,,海船,交通建设四号,中交疏浚（集团）股份有限公司,中交疏浚（集团）股份有限公司,工程船,5db846de5235e701bc7c08bd
31,1990Q0000812,9999,,海船,长宇,深圳长航滚装物流有限公司,深圳长航滚装物流有限公司,滚装船,5db846de5235e701bc7c08be
32,2014W0000390,29266,,海船,利电9,江阴利电煤炭运销有限公司,江阴利电煤炭运销有限公司,散货船,5db846de5235e701bc7c08bf
33,2012X0000212,423,,海船,华电2001,华电曹妃甸重工装备有限公司,华电曹妃甸重工装备有限公司,工程船,5db846de5235e701bc7c08c0
34,2007U0000003,411,,河船,中海拖2,中海工业(上海长兴)有限公司,中海工业(上海长兴)有限公司,普通拖船,5db846de5235e701bc7c08c1
35,1989H0000796,25891,,海船,银鹏,上海时代航运有限公司,上海时代航运有限公司,散货船,5db846de5235e701bc7c08c2
36,2011X0000042,19917,,海船,长骄海,长航货运有限公司,长航货运有限公司,散货船,5db846de5235e701bc7c08c3
37,2015X0001366,476,,海船,交工3,中交一航局第三工程有限公司,中交一航局第三工程有限公司,普通拖船,5db846de5235e701bc7c08c4
38,2016W0000247,951,,河船,通达化888,泰兴市通达航运有限公司,泰兴市通达航运有限公司,化学品液货船,5db846de5235e701bc7c08c5
39,1980M0001064,1595,,海船,恒宇1,广东瑞高海运物流有限公司,广东瑞高海运物流有限公司,油船（闪点≤60℃）,5db846de5235e701bc7c08c6
40,2013P0000627,389,,海船,嘉港拖10,浙江嘉兴港口服务集团有限公司,浙江嘉兴港口服务集团有限公司,普通拖船,5db846de5235e701bc7c08c7
41,1997N0000758,36592,,海船,北仑海72,宁波经济技术开发区龙盛航运有限公司,宁波经济技术开发区龙盛航运有限公司,散货船,5db846de5235e701bc7c08c8
42,2006B0000161,3180,,海船,隆晟7,福建隆晟船务有限公司,福建隆晟船务有限公司,散货船,5db846de5235e701bc7c08c9
43,2008T0000356,442,,海船,海洋石油502,中海福建天然气有限责任公司,中海福建天然气有限责任公司,普通拖船,5db846de5235e701bc7c08ca
44,2012Q0000573,2537,,海船,中燃32,上海通银石油化工有限公司,上海中燃船舶燃料有限公司,油船（闪点>60℃）,5db846de5235e701bc7c08cb
45,2006V0000248,375,,海船,福海1号,宁波鼎盛海运服务有限公司,浙江大唐乌沙山发电有限责任公司,普通拖船,5db846de5235e701bc7c08cc
46,2006U0000017,3440,,海船,长洋驳2,上海新洋山集装箱运输有限公司,上海新洋山集装箱运输有限公司,顶推船D驳船组合体-驳船,5db846de5235e701bc7c08cd
47,2007G4000220,2237,,河船,神州2009,重庆新金航国际物流股份有限公司,重庆新金航国际物流股份有限公司,化学品液货船,5db846de5235e701bc7c08ce
48,2015B0000518,2009,,河船,鑫联28,扬州鑫联运输有限公司,扬州鑫联运输有限公司 ,化学品液货船,5db846de5235e701bc7c08cf
49,2015V0000375,545,,海船,远驳十八,大连中远船务工程有限公司,大连中远船务工程有限公司,甲板货驳,5db846de5235e701bc7c08d0
50,2015T0000442,496,,海船,曹港23,唐山港曹妃甸拖船有限公司,唐山港曹妃甸拖船有限公司,普通拖船,5db846de5235e701bc7c08d1
51,2010Q0001176,270,,海船,海洋风电22,江苏韩通海洋装备有限公司,江苏韩通海洋装备有限公司,抛锚船,5db846de5235e701bc7c08d2
52,1998C0000757,27562,,海船,国电32,天津国电海运有限公司,天津国电海运有限公司,散货船,5db846de5235e701bc7c08d3
53,2014L0000403,2512,,河船,新长江25058,长航货运有限公司,长航货运有限公司,散货船,5db846de5235e701bc7c08d4
54,2013S0000308,2844,,河船,长江祥龙,兴化市航运有限公司,兴化市航运有限公司,油船（闪点≤60℃）,5db846de5235e701bc7c08d5
55,2012M0001099,523,,河船,紫光3号趸,重庆紫光新科化工开发有限公司,重庆紫光新科化工开发有限公司,化学品液货囤,5db846de5235e701bc7c08d6
56,2012M0001099,523,,河船,紫光3号趸,重庆紫光新科化工开发有限公司,重庆紫光新科化工开发有限公司,化学品液货囤,5db846de5235e701bc7c08d7
57,1992P0000829,13907,,海船,新祥瑞,上海洋浦浙海海运有限公司,上海洋浦浙海海运有限公司,散货船,5db846de5235e701bc7c08d8
58,2012U0001037,24750,,海船,中昌288,舟山中昌海运有限责任公司,华融金融租赁股份有限公司,散货船,5db846de5235e701bc7c08d9
59,1999D0000675,15525,,海船,瑞康36,宁波瑞康海运有限公司,宁波瑞康海运有限公司,一般干货船,5db846de5235e701bc7c08da
60,2010Y2107501,1205,,海船,民生602,天津市旭日海运有限公司,民生金融租赁股份有限公司,供应船,5db846de5235e701bc7c08db
61,2009E0000490,962,,河船,长轮36028,中石化长江燃料有限公司九江分公司,中石化长江燃料有限公司,油囤,5db846de5235e701bc7c08dc
62,2012F0000242,2512,,河船,新长江25035,长航货运有限公司,长航货运有限公司,散货船,5db846de5235e701bc7c08dd
63,2018V0000218,8467,,河船,民悦,民生轮船股份有限公司,民生轮船股份有限公司,滚装船,5db846de5235e701bc7c08de
64,2012K0001373,1788,,河船,长轮39003,中石化长江燃料有限公司芜湖分公司,中石化长江燃料有限公司,油囤,5db846de5235e701bc7c08df
65,2011Q0001139,1290,,河船,梧州石油208,广西梧州中昊实业有限责任公司,广西梧州中昊实业有限责任公司,油船（闪点≤60℃）,5db846de5235e701bc7c08e0
66,2014X0000460,31643,,海船,利电21,上海中信轮船有限公司,中信寰球商贸（上海）有限公司,散货船,5db846de5235e701bc7c08e1
67,2012Y0000949,1458,,海船,洋海之光,三亚洋海船务实业有限公司,三亚洋海船务实业有限公司,客船,5db846de5235e701bc7c08e2
68,2006K0000008,7971,,海船,集海之星,上海海华轮船有限公司,上海海华轮船有限公司,集装箱船,5db846de5235e701bc7c08e3
69,2008Q0000514,33511,,海船,永隆桂,洋浦永隆海运有限公司,洋浦永隆海运有限公司,散货船,5db846de5235e701bc7c08e4
70,2018V0000195,8380,,河船,安吉209,上海安盛汽车船务有限公司,上海安盛汽车船务有限公司,滚装船,5db846de5235e701bc7c08e5
71,2017T0001058,596,,海船,中国海监201,国家海洋局东海分局,国家海洋局东海分局,科学调查船,5db846de5235e701bc7c08e6
72,2012N0000985,984,,海船,创兴拖002,日照华勇海运有限公司,山东海顺港航工程有限公司,普通拖船,5db846de5235e701bc7c08e7
73,2002M0000411,326,,海船,华海拖3,钦州华西船务工程有限公司,钦州华西船务工程有限公司,普通拖船,5db846de5235e701bc7c08e8
74,2012D0000401,2512,,河船,新长江25016,长航货运有限公司,长航货运有限公司,散货船,5db846de5235e701bc7c08e9
75,2013J0000139,3549,,河船,远洋9007,重庆市泽胜船务（集团）有限公司,重庆市泽胜船务（集团）有限公司,化学品液货船,5db846de5235e701bc7c08ea
76,2018D0000064,462,,海船,烟港拖27,烟台港股份有限公司,烟台港股份有限公司,普通拖船,5db846de5235e701bc7c08eb
77,1997E0000796,38878,,海船,北仑海26,宁波经济技术开发区龙盛航运有限公司,宁波经济技术开发区龙盛航运有限公司,散货船,5db846de5235e701bc7c08ec
78,2012G0001002,2512,,河船,新长江25045,长航货运有限公司,工银金融租赁有限公司,散货船,5db846de5235e701bc7c08ed
79,2008T0000011,2717,,河船,荣江14029,长航凤凰股份有限公司,民生金融租赁股份有限公司,散货船,5db846de5235e701bc7c08ee
80,2012D0000493,5766,,海船,一舟2,浙江一舟海运有限公司,浙江一舟海运有限公司,油船（闪点≤60℃）,5db846de5235e701bc7c08ef
81,2012U0001244,1869,,海船,鑫丰216,大连鸿畅海运有限公司,大连鸿畅海运有限公司,油船（闪点≤60℃）,5db846de5235e701bc7c08f0
82,2.01E+38,384,,海船,长鳄2号,长江宜昌航道工程局,长江宜昌航道工程局,绞吸式挖泥船,5db846de5235e701bc7c08f1
83,2018K0000323,6247,,海船,魏桥佳达69,天津惠桥船务有限公司,交银金融租赁有限责任公司,散货船,5db846de5235e701bc7c08f2
84,2014K0000954,483,,海船,北部湾拖2,北部湾拖船（防城港）有限公司,北部湾拖船（防城港）有限公司,普通拖船,5db846de5235e701bc7c08f3
85,2018M0000072,103,,海船,电投01,国家电投集团滨海海上风力发电有限公司,国家电投集团滨海海上风力发电有限公司,小艇,5db846de5235e701bc7c08f4
86,2013B0000431,29203,,海船,永盛茂,洋浦永盛海运有限公司,洋浦永盛海运有限公司,散货船,5db846de5235e701bc7c08f5
87,2018T0000331,2321,,海船,海洋石油791,中海油能源发展装备技术有限公司,中海油能源发展装备技术有限公司,科学调查船,5db846de5235e701bc7c08f6
88,2010W0000607,3166,,河船,远洋7603,重庆市泽胜船务（集团）有限公司,重庆市泽胜船务（集团）有限公司,化学品液货船,5db846de5235e701bc7c08f7
89,2017T0000874,1603,,河船,鄂潜江货1098,潜江市隆昌航运有限公司,潜江市隆昌航运有限公司,化学品液货船,5db846de5235e701bc7c08f8
90,2013V0000449,2416,,海船,皖江6,安徽省皖江轮船运输有限公司,皖江金融租赁股份有限公司,化学品液货船,5db846de5235e701bc7c08f9
91,3000R0000358,920,,河船,深能625,贵州深能航运股份有限公司,贵州深能航运股份有限公司,集装箱船,5db846de5235e701bc7c08fa
92,2012R0001379,2235,,河船,宜石2068,宜昌实华商贸有限责任公司,宜昌实华商贸有限责任公司,化学品液货船,5db846de5235e701bc7c08fb
93,3000M0000515,916,,海船,WZ1310,广东旭日海运有限公司,广东旭日海运有限公司,工程船,5db846de5235e701bc7c08fc
94,1994X0000027,1588,,海船,源汉油1,深圳市源汉船务运输有限公司,深圳市源汉船务运输有限公司,油船（闪点≤60℃）,5db846de5235e701bc7c08fd
95,2011Y0001124,2579,,海船,海达788,厦门通海船务有限公司,厦门通海船务有限公司,油船（闪点≤60℃）,5db846de5235e701bc7c08fe
96,2011K0000076,28757,,海船,大唐7号,江苏大唐航运股份有限公司,工银金融租赁有限公司,散货船,5db846de5235e701bc7c08ff
97,2008R0000354,479,,海船,海港39,上海港复兴船务有限公司,上海港复兴船务有限公司,普通拖船,5db846de5235e701bc7c0900
98,2012V0000164,450,,海船,烟港拖21,烟台港轮驳有限公司,烟台港轮驳有限公司,普通拖船,5db846de5235e701bc7c0901
99,2012S0000552,19559,,海船,浩云99,舟山港综合保税区京鸿宇物流有限公司,舟山港综合保税区京鸿宇物流有限公司,散货船,5db846de5235e701bc7c0902
100,2013K0000393,1868,101,河船,长燃荆楚68,武汉长燃运输有限公司,武汉长燃运输有限公司,化学品液货船,5db846df5235e701bc7c0903
101,2012T0000530,2214,102,河船,神州2029,重庆新金航国际物流股份有限公司,重庆新金航国际物流股份有限公司,化学品液货船,5db846df5235e701bc7c0904
102,2015C0000220,3769,103,河船,新长江06053,长航货运有限公司,交银金融租赁有限责任公司,散货船,5db846df5235e701bc7c0905
103,2012Y0000029,5960,104,海船,海峡一号,海南海峡航运股份有限公司,海南海峡航运股份有限公司,客滚船,5db846df5235e701bc7c0906
104,2009P0000361,17887,105,海船,明州62,宁波海运股份有限公司,宁波海运股份有限公司,散货船,5db846df5235e701bc7c0907
105,2019Y0000506,36247,106,海船,万铭民主,浙江万铭海运有限公司,浙江万铭海运有限公司,散货船,5db846df5235e701bc7c0908
106,2012Q0001263,3643,107,河船,远洋9605,重庆市泽胜船务（集团）有限公司,重庆市泽胜船务（集团）有限公司,化学品液货船,5db846df5235e701bc7c0909
107,2005B0000474,39962,108,海船,巨大,青岛远洋运输有限公司,中远海运散货运输有限公司,散货船,5db846df5235e701bc7c090a
108,2013W0000220,25980,109,海船,明盛海,平潭明辉海运有限公司,平潭明辉海运有限公司,散货船,5db846df5235e701bc7c090b
109,2009F0000146,15824,110,海船,天台9,临海市回浦海运有限公司,李爱平等,散货船,5db846df5235e701bc7c090c
110,2013C0000179,1307,111,海船,昱荣,天津天丰昱成石油有限公司,天津天丰昱成石油有限公司,油船（闪点>60℃）,5db846df5235e701bc7c090d
111,2015T0000143,2994,112,海船,鑫丰518,大连鸿畅海运有限公司,大连鸿畅海运有限公司,油船（闪点≤60℃）,5db846df5235e701bc7c090e
112,2007D4000217,2237,113,河船,神州2005,重庆新金航国际物流股份有限公司,重庆新金航国际物流股份有限公司,化学品液货船,5db846df5235e701bc7c090f
113,2008U0000173,1922,114,海船,国裕海拖2号,武汉江裕海运发展有限公司,武汉江裕海运发展有限公司,普通推船,5db846df5235e701bc7c0910
114,2012M0000110,558,115,海船,德滋,烟台打捞局,烟台打捞局,普通拖船,5db846df5235e701bc7c0911
115,1995C0000845,29195,116,海船,信风宁波,宁波营港利信物流有限公司,宁波营港利信物流有限公司等,集装箱船,5db846df5235e701bc7c0912
116,2.01E+222,4175,117,河船,港盛1010,重庆港盛欣陵船务有限公司,重庆港盛船务有限公司,集装箱船,5db846df5235e701bc7c0913
117,2012G0001324,627,118,海船,唐山湾壹号,唐山湾国际旅游岛旅游发展有限公司,唐山湾国际旅游岛旅游发展有限公司,高速客船,5db846df5235e701bc7c0914
118,2014S0000248,25535,119,海船,黄船030,中船黄埔文冲船舶有限公司,中船黄埔文冲船舶有限公司,半潜船,5db846df5235e701bc7c0915
119,2019J0000469,2263,120,河船,强盛55,安徽强盛船务有限公司,安徽强盛船务有限公司,化学品液货船,5db846df5235e701bc7c0916
120,2010V0000537,2140,121,海船,东雷奋进,上海晟敏海洋工程有限公司,上海晟敏海洋工程有限公司,供应船,5db846df5235e701bc7c0917
121,2011A0001125,2998,122,海船,闽油103,福建省实华船务有限公司,福建省实华船务有限公司,油船（闪点≤60℃）,5db846df5235e701bc7c0918
122,2012K0000361,5621,123,河船,民觉,民生轮船股份有限公司,民生轮船股份有限公司,集装箱船,5db846df5235e701bc7c0919
123,1997R0000692,3824,124,海船,富达302,湛江市富达水运船务有限公司,湛江市富达水运船务有限公司,油船（闪点>60℃）,5db846df5235e701bc7c091a
124,2005P0000394,361,125,河船,华汉趸2号,华新水泥（黄石）散装储运有限公司,华新水泥（黄石）散装储运有限公司,港用囤船,5db846df5235e701bc7c091b
125,2006G0000028,2268,126,河船,新钢港2号,武钢港务公司,武汉钢铁(集团)公司,起重船,5db846df5235e701bc7c091c
126,2009Y0000554,1783,127,河船,重轮化2002,重庆凯美特航运有限公司,重庆凯美特航运有限公司,化学品液货船,5db846df5235e701bc7c091d
127,2012X0001339,2512,128,河船,新长江25063,长航货运有限公司,工银金融租赁有限公司,散货船,5db846df5235e701bc7c091e
128,2008M0000166,996,129,海船,浙玉车渡5,玉环滚装轮渡有限公司,玉环滚装轮渡有限公司,客滚船,5db846df5235e701bc7c091f
129,2004D0000191,5680,130,海船,金紫荆,广东徐闻港航控股有限公司,广东徐闻港航控股有限公司,客滚船,5db846df5235e701bc7c0920
130,2004D0000191,5680,131,海船,金紫荆,广东徐闻港航控股有限公司,广东徐闻港航控股有限公司,客滚船,5db846df5235e701bc7c0921
131,2016L0000283,992,132,河船,通达化0096,江西通达航运股份有限公司,江西通达航运股份有限公司,化学品液货船,5db846df5235e701bc7c0922
132,3000A0000550,44800,133,海船,4000TEU集装箱船,台州市凯航海运有限公司,台州市建兴重工有限公司,集装箱船,5db846df5235e701bc7c0923
133,2011V0000569,16617,134,海船,五星交院,台州五星海运有限公司,台州五星海运有限公司及何恩德,散货船,5db846df5235e701bc7c0924
134,2013P0000765,499,135,海船,通宇11,宁波连悦船务有限公司,宁波连悦船务有限公司,油船（闪点>60℃）,5db846df5235e701bc7c0925
135,2012A0000559,3769,136,河船,新长江06003,长航货运有限公司,交银金融租赁有限责任公司,散货船,5db846df5235e701bc7c0926
136,2013N0000534,30876,137,海船,明州36,宁波江海运输有限公司,招银金融租赁有限公司,散货船,5db846df5235e701bc7c0927
137,1994Y5102785,2364,138,海船,晨扬10,浙江舟山晨扬岛际危险品运输有限公司,浙江舟山晨扬岛际危险品运输有限公司,滚装船,5db846df5235e701bc7c0928
138,2006U0000040,3814,139,河船,浦海227,上海浦海航运有限公司,上海浦海航运有限公司,集装箱船,5db846df5235e701bc7c0929
139,2013X0001256,934,140,海船,海洋67,江苏韩通海洋装备有限公司,江苏韩通海洋装备有限公司,甲板货驳,5db846df5235e701bc7c092a
140,2012X0000005,30334,141,海船,明州57,宁波海运股份有限公司,宁波海运股份有限公司,散货船,5db846df5235e701bc7c092b
141,2019J0000101,8800,142,河船,久海,中江海物流有限公司,中江海物流有限公司,滚装船,5db846df5235e701bc7c092c
142,2.02E+100,4124,143,海船,华晨668,乐清市华远海运有限公司,乐清市华远海运有限公司,油船（闪点≤60℃）,5db846df5235e701bc7c092d
143,2007U0000325,848,144,河船,渝港趸6510,重庆化工码头有限公司,重庆化工码头有限公司,化学品液货囤,5db846df5235e701bc7c092e
144,2018G0000228,3255,145,河船,江隆9004,重庆市泽胜船务（集团）有限公司,重庆市江隆宏元船务有限公司,化学品液货船,5db846df5235e701bc7c092f
145,2015G0000546,1864,146,海船,中港油201,天津中港伟业物流有限责任公司,天津中港伟业物流有限责任公司,油船（闪点>60℃）,5db846df5235e701bc7c0930
146,2018F0000388,3255,147,河船,江隆9005,重庆市江隆宏元船务有限公司,重庆市江隆宏元船务有限公司,化学品液货船,5db846df5235e701bc7c0931
147,2016G0000785,10387,148,海船,海口16号,海口能运船务有限公司,海口能运船务有限公司、海南嘉和海运有限公司,客滚船,5db846df5235e701bc7c0932
148,2019T0000593,6812,149,海船,博大61,象山兴宁航运有限公司,宁波博大船业有限公司,集装箱船,5db846df5235e701bc7c0933
149,1985P0000651,3904,150,河船,长航江山9,重庆长江轮船公司,重庆长江轮船公司,客船,5db846df5235e701bc7c0934
150,1993D0000253,1715,151,海船,海口一号,海口能运船务有限公司,海口能运船务有限公司,客滚船,5db846df5235e701bc7c0935
151,2012W0001338,81,152,河船,长江水文203,长江水利委员会水文局长江三峡水文水资源勘测局,长江水利委员会水文局长江三峡水文水资源勘测局,测量船,5db846df5235e701bc7c0936
152,3000J0000972,499,153,海船,54M化学品船,台州市万州海运有限公司,台州市万州海运有限公司,化学品液货船,5db846df5235e701bc7c0937
153,2014N0000451,2646,154,河船,大洋86,重庆涪陵港江水运有限公司,重庆涪陵港江水运有限公司,油船（闪点>60℃）,5db846df5235e701bc7c0938
154,2007U0000187,2955,155,河船,渝沪3501,重庆凯美特航运有限公司,重庆凯美特航运有限公司,化学品液货船,5db846df5235e701bc7c0939
155,2012Y0000213,24813,156,海船,远翔20,台州新诺海运有限公司,台州新诺海运有限公司,散货船,5db846df5235e701bc7c093a
156,2011J0000972,2998,157,海船,海之星588,厦门海之星航运有限公司,厦门海之星航运有限公司,油船（闪点≤60℃）,5db846df5235e701bc7c093b
157,1995R0000835,26748,158,海船,新永安1,中海散货运输(上海)有限公司,中海散货运输(上海)有限公司,散货船,5db846df5235e701bc7c093c
158,2009N0000176,14246,159,海船,东成山,唐山东方海运有限公司,唐山东方海运有限公司,散货船,5db846df5235e701bc7c093d
159,2013Y0000590,5138,160,海船,稳进号,江苏稳进海运有限公司,江苏稳进海运有限公司,油船（闪点≤60℃）,5db846df5235e701bc7c093e
160,2017C0001411,1852,161,河船,长轮39016,中石化长江燃料有限公司镇江分公司,中石化长江燃料有限公司,油囤,5db846df5235e701bc7c093f
161,2007L0000110,266,162,海船,交工66,中交一航局第一工程有限公司,中交一航局第一工程有限公司,普通拖船,5db846df5235e701bc7c0940
162,2012U0000163,462,163,海船,岚港拖16,日照港股份有限公司,日照港股份有限公司,普通拖船,5db846df5235e701bc7c0941
163,2008K0000486,15824,164,海船,长永海,长航货运有限公司,长航货运有限公司,散货船,5db846df5235e701bc7c0942
164,3000S0000474,6597,165,海船,东泽59,江苏苏美达船舶工程有限公司,江苏苏美达船舶工程有限公司,集装箱船,5db846df5235e701bc7c0943
165,2012H4100661,2,166,河船,中国海关3522,中华人民共和国黄埔海关,中华人民共和国黄埔海关,巡逻船,5db846df5235e701bc7c0944
166,2014J0000562,98,167,河船,中国海关2007,中华人民共和国广州海关,中华人民共和国广州海关,巡逻船,5db846df5235e701bc7c0945
167,2012H0000727,2991,168,海船,祥鸿3,浙江祥鸿船务有限公司,浙江祥鸿船务有限公司,油船（闪点≤60℃）,5db846df5235e701bc7c0946
168,2017Y0000373,805,169,海船,海洋风电11,南通市海洋水建工程有限公司,南通市海洋水建工程有限公司,工程船,5db846df5235e701bc7c0947
